Front,Back
Provide an example of a data structure with bad locality.,"A hash table, which tends to scatter memory references across different pages."
What are 'clean pages' in the context of program structure and paging?,"Code pages that are read-only and never modified; they are beneficial because they do not need to be paged out, saving I/O operations."
How can loaders optimize for paging performance?,By avoiding placing routines across page boundaries (keeping a routine in one page) and by packing frequently called routines into the same page.
What is the purpose of 'I/O interlock' and 'page locking' in demand paging?,"To allow pages to be fixed in memory (locked) and prevent them from being paged out, particularly during I/O operations to user memory."
Describe the problem scenario that page locking addresses during I/O.,"If a process initiates an I/O operation to a user memory buffer, and that page is subsequently swapped out by another process through global replacement, the pending I/O operation would then target an incorrect or different page frame."
"What is one solution to the I/O interlock problem, besides page locking?","Never executing I/O directly to user memory, instead copying data between system memory and user memory; however, this incurs potentially high overhead."
How does a 'lock bit' function in page locking?,"A 'lock bit' is associated with every frame, and when set, prevents that frame from being selected for replacement by the page replacement algorithm."
How are lock bits used when performing a disk write operation?,"The pages containing the block to be written are locked into memory before the I/O operation starts, and then unlocked once the I/O is complete."
Why are some or all OS kernel pages often locked into memory?,"Many operating systems cannot tolerate a page fault occurring within the kernel itself, as it could lead to system instability."
Define pinning in the context of page locking.,"The act of locking pages into memory, often initiated by user processes, to prevent them from being paged out."
Give an example of a user process that might utilize page pinning.,"A database process that manages a large chunk of memory and frequently moves blocks between secondary storage and memory, benefiting from persistent memory residency."
What is a potential danger or downside of using the lock bit feature?,"A bug could cause a lock bit to be turned on but never turned off, rendering the locked frame permanently unusable."
How does Solaris handle applications' requests for page locking (pinning)?,"Solaris allows applications to provide locking 'hints', but the OS can disregard these hints if the free-frame pool is too small or if a process requests an excessive number of locked pages."
What is the primary role of mass storage in computer systems?,To permanently store files and data.
What types of secondary storage do modern computers primarily use?,Hard disk drives (HDDs) and nonvolatile memory (NVM) devices.
List common variations among secondary storage devices.,"Transfer (character at a time vs. block), Access (sequentially vs. randomly), Data transfer (synchronously vs. asynchronously), Usage (dedicated vs. shared), Read-only vs. read-write, Speed (slowest major component)."
What are the key goals of an OS I/O subsystem?,"Provide the simplest interface possible to the rest of the system, and optimize I/O for maximum concurrency (devices are performance bottleneck)."
What is 'mass storage'?,The nonvolatile storage system of a computer.
What is the main mass-storage system?,Secondary storage (HDDs and NVM devices).
What types of tertiary storage exist for some systems?,"Slower, larger storage like magnetic tape, optical disks, and cloud storage."
What is the general term for all types of non-volatile storage?,"Non-volatile storage (NVS) or ""storage drives""."
hard disk drive (HDD),"Secondary storage device based on mechanical components (spinning magnetic media platters, moving read-write heads)."
nonvolatile memory (NVM),Persistent storage based on circuits and electric charges.
How is information stored and read on an HDD platter?,Information is stored by recording magnetically and read by detecting magnetic patterns.
platter,HDD component with a magnetic media layer for holding charges; flat circular shape (like a CD).
disk arm,"HDD component holding read-write heads, which moves all heads as a unit over cylinders of platters."
track,"On an HDD platter, the medium under the read-write head during platter rotation; logically a circular division of the platter surface."
sectors,"On an HDD platter, fixed-size sections that subdivide tracks."
cylinder,"On an HDD, the set of tracks under read-write heads on all platters in the device at a given arm position."
What is the smallest unit of transfer on an HDD?,A sector.
"What was the common sector size for HDDs until around 2010, and what is it migrating to?","Commonly 512 bytes until ~2010, then migrating to 4KB."
What are common rotation speeds (RPM) for HDD motors?,"5,400, 7,200, 10,000, 15,000 RPM."
transfer rate,The rate at which data flows between the drive and the computer.
positioning time,"On an HDD, the time for the read-write head to position over the desired track; also known as random-access time."
What are the two parts of positioning time (random-access time) for an HDD?,Seek time and rotational latency.
seek time,"On an HDD, the time for the disk arm to move the read-write head to the desired cylinder."
rotational latency,"On an HDD, the time for the desired sector to rotate to the disk head once the head is over the desired cylinder."
What are typical performance figures for modern disks in terms of transfer rate and latency?,"Tens to hundreds of MB/sec transfer, several milliseconds seek/rotational latency."
How do drive controllers improve HDD performance?,By using DRAM buffers.
head crash,"On an HDD, a mechanical problem where the read-write head touches the platter surface."
What is the consequence of a head crash on an HDD?,"It's normally irreparable, the entire disk is replaced, and data is lost unless backed up or RAID protected."
effective transfer rate,"The actual, measured transfer rate of data between two devices, which is typically lower than published rates."
What are NVM devices composed of?,A controller and flash NAND die semiconductor chips that store data.
solid-state disk (SSD),A disk-drive-like storage device using flash-memory-based nonvolatile memory.
USB drive,Nonvolatile memory in the form of a device that plugs into a USB port (also known as thumb drive/flash drive).
What are the advantages of NVM devices over HDDs?,"They are more reliable (no moving parts), faster (no seek/rotational latency), and consume less power."
What are the disadvantages of NVM devices compared to larger HDDs?,They are more expensive per MB and have less capacity.
What are the storage and reliability challenges with NAND semiconductors?,"Data cannot be overwritten directly (NAND cells must be erased first), and they deteriorate with every erase cycle (~100,000 program-erase cycles)."
"In what increments are NAND flash devices read/written, and in what increments are they erased?","Read/write in ""page"" increments (similar to a sector), and erasure occurs in ""block"" increments (several pages), which is much slower."
How is NVM lifespan measured?,In Drive Writes Per Day (DWPD).
flash translation layer (FTL),"For nonvolatile memory, a table maintained by the controller that maps physical pages to currently valid logical blocks."
What happens when a full SSD has a pending write and no free blocks?,"If no free blocks but individual pages hold invalid data, garbage collection occurs, where good data is copied to other locations, freeing blocks for erase/writes."
garbage collection,"The recovery of space containing no-longer-valid data, typically by copying valid data to new locations and then erasing the old block."
over-provisioning,"In non-volatile memory, space (e.g., 20% of total) set aside by the device as always available write area, not counted in device free space."
wear leveling,"In nonvolatile memory, an effort by the controller to select all NAND cells over time as write targets to avoid premature media failure due to frequently erased blocks."
How do NVM devices provide data protection?,They include error-correcting codes (ECC) calculated and stored with the data to detect and correct errors.
RAM drives,"Sections of a system's DRAM presented as secondary storage devices, created by device drivers."
What is a practical use of RAM drives despite their volatility?,"To allow users/programmers to place data in memory for temporary safekeeping using standard file operations, useful for temporary files or sharing data."
magnetic tape,"A nonvolatile magnetic media storage device (tape spooled on reels, passing over a read-write head); mostly used for backups, infrequently used info, or transferring info between systems."
How do magnetic tapes compare to main memory and drives in terms of random access time?,"Random access is very slow: ~1000x slower than HDDs, ~100,000x slower than SSDs."
"Once positioned correctly, how fast do tape drives read/write?",At speeds comparable to HDDs.
I/O bus,Physical connection of an I/O device to a computer system.
List some common bus types for connecting secondary storage.,"Advanced Technology Attachment (ATA), Serial ATA (SATA), eSATA, Serial Attached SCSI (SAS), Universal Serial Bus (USB), Fibre Channel (FC)."
Which bus type is most common for secondary storage?,SATA.
NVM express (NVMe),"A high-speed I/O bus specifically for NVM storage, which directly connects the device to the system PCI bus to increase throughput and decrease latency."
controller,A special processor managing I/O devices.
host bus adapter (HBA),A device controller installed in a host bus port to allow a device connection to the host.
host controller,"I/O-managing processors within a computer (e.g., inside an HBA)."
device controller,An I/O managing processor built into each storage device.
How does a mass storage I/O operation typically proceed?,"The computer places a command into the host controller (via memory-mapped I/O ports), which then sends the command via messages to the device controller. The device controller operates the drive hardware."
"Where does data transfer occur at the drive, and then to the host?","At the drive, data transfers between the device controller's built-in cache and the storage media. Data then transfers to the host between the cache and host DRAM via DMA at fast electronic speeds."
logical blocks,Logical addresses used to access blocks on storage devices; also the smallest unit of transfer.
How are storage devices logically addressed?,As large one-dimensional arrays of logical blocks.
What does a logical block map to physically on a device?,A physical sector or a semiconductor page.
"Why is converting LBA to old-style disk addresses (cylinder, track, sector) difficult in practice?","Because of defective sector substitution with spares, non-constant sectors per track on some drives, and internal management by disk manufacturers that hides the true physical mapping."
What assumption do algorithms dealing with HDDs make about logical and physical addresses?,That ascending logical addresses correspond to ascending physical addresses.
constant linear velocity (CLV),A device-recording method where bit density is uniform per track by varying the rotational speed of the medium.
Why do outer tracks in CLV have more sectors?,Because they are longer and bit density is uniform.
Where is CLV commonly used?,In CD-ROM and DVD-ROM drives.
constant angular velocity (CAV),"A device-recording method where the medium spins at a constant velocity, and bit density decreases from inner to outer tracks to maintain a constant data rate."
Where is CAV commonly used?,In hard disks.
"What is the OS's responsibility regarding hardware efficiency, especially for HDDs?","For HDDs, the OS is responsible for minimizing access time and maximizing data transfer bandwidth."
What is access time for HDDs/mechanical storage?,"It is the total time required to read or write data, consisting of seek time and rotational latency."
"Define ""seek time"" in the context of HDD access time.",The time for the device arm to move heads to the desired cylinder.
"Define ""rotational latency"" in the context of HDD access time.",The additional time for the platter to rotate the desired sector to the head.
"Define ""device bandwidth"" for HDDs.",Total bytes transferred divided by total time (from the first request to the last transfer completion).
How can access time and bandwidth be improved for HDDs?,By managing the order of storage I/O requests.
How does a process initiate an I/O request?,It issues a system call to the OS.
What information does an I/O request typically specify?,"Input/output direction, open file handle, memory address, and amount of data."
What happens if the drive/controller is available when an I/O request is made?,The request is serviced immediately.
What happens if the drive/controller is busy when a new I/O request is made?,New requests are placed in a queue.
What is common about device queues in a multiprogramming system?,They often have pending requests.
What is the benefit of having a queue of I/O requests for device drivers?,"It allows device drivers to improve performance by ordering requests (e.g., avoiding head seeks)."
How did past HDD interfaces differ from modern drives regarding control over physical locations?,"Past HDD interfaces allowed the host to specify track/head, leading to much effort on disk scheduling; modern drives do not expose these controls and map LBA to physical addresses internally."
What are the current goals of disk scheduling?,"Fairness, timeliness, and optimizations (e.g., bunching sequential reads/writes)."
When do drives perform best?,With sequential I/O.
Is absolute knowledge of head/physical block/cylinder locations possible on modern drives?,Generally not possible.
What approximation is used for LBA to physical address mapping on modern drives?,"Increasing LBAs generally mean increasing physical addresses, and close LBAs equate to physical proximity."
"What is the simplest disk scheduling algorithm, and what are its alternative names?","First-Come, First-Served (FCFS) or FIFO."
Is FCFS disk scheduling fair?,"Yes, it is intrinsically fair."
Does FCFS provide the fastest service?,"Generally, no."
"What is a common problem with FCFS disk scheduling, especially illustrated by a ""wild swing"" example?","It can lead to inefficient head movement (e.g., a ""wild swing"" where the head moves far for one request, then far back for another, then far forward again), not optimizing for seek time."
Define the SCAN algorithm for HDD I/O scheduling.,"The disk arm starts at one end, moves to the other, servicing requests, and when it reaches the other end, its direction is reversed, and servicing continues."
What is another name for the SCAN algorithm?,Elevator algorithm.
"In the SCAN algorithm, what happens to a request just in front of the head?",It is serviced almost immediately.
"In the SCAN algorithm, what happens to a request just behind the head?","It waits until the arm moves to the end, reverses, and comes back."
"With a uniform distribution of requests, where is the heaviest density of requests in SCAN, and where are there few requests after reversal?",Few requests are immediately in front of the head after reversal (recently serviced); the heaviest density of requests is at the other end of the disk (where requests have waited longest).
Define Circular SCAN (C-SCAN) scheduling.,"A variant of SCAN where the head moves from one end to the other, servicing requests, but upon reaching the other end, it immediately returns to the beginning of the disk without servicing requests on the return trip."
What is the primary goal or benefit of C-SCAN scheduling compared to SCAN?,To provide more uniform wait time.
How does C-SCAN conceptually treat cylinders?,As a circular list.
Are many disk-scheduling algorithms commonly used?,"No, many exist but are rarely used."
"Is an optimal order definable for any request list, and is its computation always justified?","Yes, an optimal order can be defined, but its computation may not justify the savings over simpler algorithms like SCAN."
What heavily influences the performance of a disk-scheduling algorithm?,The number and types of requests.
How do all disk scheduling algorithms behave if there is only one outstanding request in the queue?,They all behave like FCFS.
Which disk scheduling algorithms are generally better for heavy disk load and less likely to cause starvation?,SCAN and C-SCAN.
Which Linux scheduler was created to prevent starvation?,The deadline scheduler.
What type of queues does the Linux deadline scheduler maintain?,Separate read and write queues.
Why does the Deadline scheduler give reads priority?,Because processes are more likely to block on read operations.
How are the queues in the Deadline scheduler sorted?,"In LBA (Logical Block Addressing) order, which implements a C-SCAN like behavior."
How are I/O requests typically sent in the Deadline scheduler?,"In batches, sorted by LBA order."
"How many queues does the Deadline scheduler specifically keep, and how are they organized?","Four queues: two read queues and two write queues (one of each sorted by LBA, the other by FCFS)."
How does the Deadline scheduler check for and prevent starvation of FCFS requests?,"After each batch, it checks if any FCFS requests are older than a configured age (default 500 ms); if so, the LBA queue (read/write) containing the old request is selected for the next batch."
What was the default I/O scheduler in Linux RedHat 7?,The Deadline I/O scheduler.
"Besides Deadline, what other I/O schedulers were included in RHEL 7?",NOOP and Completely Fair Queueing scheduler (CFQ).
What are the characteristics of the NOOP scheduler and when is it preferred?,"It is preferred for CPU-bound systems using fast storage (NVM devices), as it does minimal work, effectively acting as FCFS."
What type of drives is the Completely Fair Queueing scheduler (CFQ) the default for?,SATA drives.
"How many queues does CFQ maintain, and how are they sorted?","Three queues (insertion sort, LBA order): real time, best effort (default), and idle."
"What are the priorities among CFQ's queues, and what is a potential issue?","Real time has the highest priority, then best effort, then idle (real time > best effort > idle); starvation is possible."
How does CFQ use historical data to optimize?,"It anticipates if a process will issue more I/O requests soon; if so, it idles waiting for new I/O, ignoring other queued requests to minimize seek time, assuming locality of reference per process."
"Define ""bandwidth"" (from table definition).",Total amount of data transferred divided by total time between first request for service and completion of last transfer.
"Define ""SCAN algorithm"" (from table definition).","HDD I/O scheduling algorithm: disk head moves from one end to other, performing I/O; then reverses."
"Define ""Circular SCAN (CSCAN) scheduling"" (from table definition).","HDD I/O scheduling algorithm: disk head moves from one end to other, performing I/O; then returns to beginning without servicing."
"Define ""Completely Fair Queueing (CFQ)"" (from table definition).","In Linux, default I/O scheduler in kernel 2.6 and later."
What is the primary goal of disk-scheduling algorithms for Hard Disk Drives (HDDs)?,To minimize disk head movement.
What distinguishes NVM devices from HDDs in terms of physical components?,NVM devices have no moving disk heads.
What common scheduling policy do NVM devices typically use?,"Simple FCFS (First-Come, First-Served)."
Define the Linux NOOP scheduler.,A Linux NVM scheduling algorithm that uses an FCFS policy and merges adjacent requests.
Describe the characteristic of read service time in NVM devices.,Uniform.
Describe the characteristic of write service time in NVM devices and why it behaves that way.,"Not uniform, due to flash memory properties."
How do some SSD schedulers handle write requests?,They merge only adjacent write requests.
How do some SSD schedulers handle read requests?,They service all read requests in FCFS order.
What are the two main types of I/O access?,Sequential and random.
For which types of devices is sequential access I/O optimal?,Mechanical devices such as HDDs and tapes.
Why is sequential access optimal for mechanical devices?,"Because the data is located near the read/write head, minimizing movement."
Define Input/Output Operations Per Second (IOPS).,"A measure of random access I/O performance, representing the number of input and output operations per second."
What effect does random access I/O have on HDDs?,It causes disk head movement.
Compare random access I/O performance between NVM (SSDs) and HDDs.,"Random access I/O is much faster on NVM (e.g., HDD hundreds of IOPS, SSD hundreds of thousands of IOPS)."
Do NVM devices offer a significant advantage for raw sequential throughput compared to HDDs?,"Less advantage, because HDD head seeks are minimized during sequential operations."
What is the performance advantage of NVM over HDD for sequential reads?,Equivalent to a 10x advantage.
How does writing to NVM compare to reading from NVM in terms of speed?,Writing is slower than reading.
How does writing impact NVM's performance advantage over HDDs?,It decreases the advantage.
Describe the consistency of write performance for HDDs throughout their lifespan.,Consistent throughout device life.
What factors cause NVM write performance to vary?,"Device fullness (due to garbage collection and over-provisioning) and ""wear""."
How does the performance of a worn NVM device compare to a new one?,Much worse performance.
How can NVM lifespan and performance be improved through file system interaction?,"The file system informs the NVM device when files are deleted, allowing the device to erase blocks."
Under what general conditions does garbage collection typically occur in an NVM device?,"When the NVM device is under a random read/write load, is full, but has free space."
What is the primary purpose of garbage collection in NVM devices?,To reclaim space from invalid data.
Describe the sequence of operations a single write might trigger due to garbage collection in an NVM device.,"Read of pages, write of good data to overprovisioning space, erase of an all-invalid-data block, and placement of the block into overprovisioning space."
Summarize the I/O operations triggered by a single write request due to garbage collection.,One page write (for the new data) + one or more page reads (by GC) + one or more page writes (for good data from GC blocks).
Define write amplification.,"Creation of I/O requests by NVM devices (GC, space management), impacting write performance."
What is the worst-case scenario for write amplification?,Several extra I/Os are triggered with each write request.
What is the fundamental importance of error detection and correction?,"They are fundamental to memory, networking, and storage."
Define: Error detection.,"Determining if a problem has occurred (e.g., data corruption)."
What actions can a system take upon detecting an error?,"Halt operation, report the error, or warn of a failing/failed device."
How do memory systems typically detect errors?,Using parity bits.
"What is a parity bit, and what is its association?","A bit associated with each byte, recording the even or odd number of 1s within that byte."
How does parity detect a single-bit error?,The calculated parity changes and does not match the stored parity.
How is an error detected if the stored parity bit itself is damaged?,It will not match the newly computed parity.
What types of errors are guaranteed to be detected by parity?,All single-bit errors.
What is a limitation of parity regarding multiple-bit errors?,Double-bit errors might go undetected.
How is a parity bit calculated?,By XORing the bits of the associated data.
What is the memory overhead required for parity?,An extra bit of memory per byte.
What general term encompasses parity as a form of error detection?,Checksums.
Define: Checksum.,A general term for an error detection and correction code.
How do checksums operate to detect errors?,"They use modular arithmetic to compute, store, and compare values on fixed-length words."
What is another error-detection method besides parity?,Cyclic redundancy check (CRCs).
Define: Cyclic redundancy check (CRCs).,An error-detection method using a hash function to detect multiple-bit errors.
Define: Error-correcting code (ECC).,"A value calculated from data bytes, recalculated later to check for changes, and capable of correcting errors."
How does ECC perform error correction?,It uses algorithms and extra storage.
What factors cause ECC codes to vary?,The extra storage needed and the number of errors correctable.
In what unit is ECC typically applied in disk drives?,Per-sector ECC.
In what unit is ECC typically applied in flash drives?,Per-page ECC.
Describe the ECC process during a write operation.,"When a controller writes a sector/page, the ECC is calculated from the data and written along with it."
Describe the ECC process during a read operation.,"When a sector/page is read, the ECC is recalculated from the data and compared with the stored ECC value."
What does an ECC mismatch during a read operation indicate?,"The data is corrupted, and the storage media may be bad."
How is ECC able to identify and correct corrupted bits?,"It contains enough information to identify changed bits and calculate correct values, provided only a few bits are corrupted."
Define: Soft error.,"A recoverable error, often by retrying the operation."
When does ECC signal a non-correctable error?,When there are too many changes for ECC to correct.
