Front,Back
Define 'buffer'.,A memory area storing data transferred between devices or between a device and an application.
What is the primary reason for using buffering?,To cope with speed mismatches between a producer and a consumer of data.
Provide an example of speed mismatch buffering.,A network (slow producer) sending data to an SSD (fast consumer); a buffer accumulates network bytes before writing them to the SSD in a single operation.
Define 'double buffering'.,"The use of two buffers to decouple a producer and a consumer, allowing for relaxed timing requirements; while one buffer is being filled, the other is being processed/written."
What other reason is there for buffering beyond speed mismatch?,"To provide adaptations for different data-transfer sizes (e.g., network fragmentation/reassembly)."
What are 'copy semantics' in the context of application I/O?,"The guarantee that data written to disk is the version present at the time the system call was made, independent of any subsequent changes to the application's buffer."
How does the OS typically guarantee copy semantics for a `write()` system call?,"The `write()` system call copies application data to a kernel buffer before returning to the application, and the disk write occurs from this kernel buffer."
"Why is copying data between kernel and application space common, despite its overhead?",Due to the clean semantics it provides.
What more efficient techniques can be used instead of direct data copying for copy semantics?,Virtual memory mapping and copy-on-write page protection.
Define 'cache'.,A region of fast memory that holds copies of data.
What is the primary benefit of accessing cached data?,Access to a cached copy is more efficient than accessing the original data.
Provide an example of caching in a computer system.,"Process instructions stored on disk are cached in physical memory, and further copied into CPU caches for faster access."
What is the key difference between a buffer and a cache?,"A buffer may hold the *only* copy of data being transferred, while a cache holds a *copy* of an item that also resides elsewhere (the original source)."
Can a memory region serve as both a buffer and a cache?,"Yes, caching and buffering are distinct concepts, but a single memory region can serve both purposes."
How do OS main memory buffers for disk data relate to caching?,"These buffers, used for copy semantics and efficient scheduling, also act as a cache to improve I/O efficiency for shared files or rapid write/reread operations."
"What action does the kernel take when a file I/O request is made, in relation to the buffer cache?","The kernel checks the buffer cache first; if the requested data is available, it avoids or defers physical disk I/O."
How do disk writes utilize the buffer cache?,"Disk writes are accumulated in the buffer cache for several seconds, allowing for more efficient write schedules."
Define 'spool' in the context of I/O.,"A buffer holding output for a device, such as a printer, that cannot accept interleaved data streams."
Why is spooling necessary for devices like printers?,"Printers can only serve one job at a time, but multiple applications may attempt to print concurrently. Spooling coordinates this concurrent output."
How does the OS implement spooling for printer output?,The OS intercepts each application's printer output and spools it to a separate file on secondary storage.
What happens after an application finishes its printing task in a spooling system?,The spooling system queues the spooled file for output to the printer.
How are spooled files then sent to the printer?,The spooling system copies the queued files to the printer one at a time.
Who manages the spooling system?,It is typically managed by a system daemon process or an in-kernel thread.
What control interfaces does the OS provide for spooling?,"It allows users to display the queue, remove jobs, or suspend printing."
"What type of devices cannot multiplex I/O requests, making spooling or exclusive access necessary?",Devices like tape drives and printers.
How do operating systems provide explicit coordination facilities for devices that cannot multiplex I/O requests?,They support exclusive device access.
Give examples of how OSes implement exclusive device access.,VMS allows a process to allocate an idle device and deallocate it when done; other OSes limit only one open file handle to such a device; Windows provides functions like `wait` for device objects or `OpenFile()` parameters for specific access types.
What is the responsibility of applications when coordinating exclusive device access?,Applications are responsible for avoiding deadlock.
What is a key role of a protected memory OS regarding errors?,"To guard against hardware and application errors, preventing system failure from minor malfunctions."
What are the two main types of I/O failure?,"Transient failures (e.g., network overloaded) and permanent failures (e.g., defective controller)."
How does the OS typically compensate for transient I/O failures?,"By retrying operations, such as a disk `read()` retry or a network `send()` resend."
What is the OS's capability to recover from a permanent failure of an important component?,The OS is unlikely to recover from such failures.
What does an I/O system call typically return to indicate its outcome?,A success/failure bit.
How does UNIX provide detailed error information from system calls?,"Through an integer variable called `errno`, which returns an error code (hundreds of possible values)."
What is the 'sense key' in SCSI protocol error reporting?,"A value in the status register indicating the general nature of a failure (e.g., hardware error, illegal request)."
What does the 'additional sense code' convey in SCSI protocol error reporting?,"The category of the failure (e.g., bad command parameter, self-test failure)."
What does the 'additional sense-code qualifier' provide in SCSI protocol error reporting?,"More specific details about the failure (e.g., which parameter was bad, which subsystem failed)."
What potential disruption can a user process cause related to I/O?,It may disrupt the system by attempting illegal I/O instructions.
How does the OS prevent user processes from issuing illegal I/O instructions?,"All I/O instructions are privileged, meaning users cannot issue them directly."
How do user programs perform I/O operations?,They must use the OS by executing a system call.
What is the OS's role when a user program makes an I/O system call?,"The OS, operating in monitor mode, checks the request's validity, performs the I/O, and then returns control to the user."
How are memory-mapped and I/O port memory locations protected from user access?,By the memory-protection system.
Are there exceptions where the kernel might allow user access to I/O memory? Provide an example.,"Yes, the kernel cannot deny all user access; for example, graphics games need direct access to memory-mapped graphics memory."
How might the kernel manage direct user access to I/O memory for specific components?,"It might provide a locking mechanism to allocate a section of memory (e.g., graphics memory) to one process at a time."
How does the kernel keep state information on I/O components?,Via in-kernel data structures.
Give an example of an in-kernel data structure used for I/O.,An open-file table structure.
What types of I/O activities do kernel data structures track?,"Network connections, character-device communications, and other I/O activities."
"How does UNIX handle differing `read()` semantics for various entities (user files, raw devices, process address spaces)?",It encapsulates these differences using an object-oriented technique.
What does an open-file record contain in UNIX to handle different file types?,A dispatch table with pointers to appropriate routines based on the file type.
"How do some operating systems, like Windows, handle I/O requests at a high level?",They use message-passing.
Describe the flow of an I/O request using message-passing in the kernel.,"An I/O request is converted into a message, sent through the kernel to the I/O manager, and then to the device driver."
What are the benefits of using message-passing for I/O in terms of system design?,"It simplifies the I/O system structure and design, and adds flexibility."
Why is power management important in data centers?,"Due to power costs, greenhouse gas emissions, and significant heat generation (cooling can use twice as much electricity as powering equipment)."
What is the OS's role in power usage in cloud computing environments?,"Adjusting processing loads, evacuating user processes, and idling/powering off systems."
How does the OS manage power for individual hardware components?,"It analyzes load and can power off hardware-enabled components (e.g., CPUs, external I/O devices) if their usage is low."
How does the OS manage power for CPU cores specifically?,"CPU cores can be suspended and resumed based on load, with their state saved and restored."
Why is power management a high priority in mobile computing?,To maximize battery life.
What is 'power collapse' in Android power management?,"A deep sleep state that uses marginally more power than being off, but responds to external stimuli and allows for quick wake-up."
How is Android's power collapse achieved?,"By powering off individual components (like screen, speakers, I/O subsystem) and placing the CPU in its lowest sleep state."
Describe Android's component-level power management.,"An infrastructure that understands component relationships and usage, where each component's device driver tracks its usage, allowing unused components to be powered off. If all components on a bus are unused, the bus is turned off; if all components in the device tree are unused, the system enters power collapse."
What is a 'device tree' in Android's power management?,A representation of the physical-device topology of the system.
Define 'wakelocks' in Android power management.,A mechanism allowing applications to temporarily prevent the system from entering a power collapse state.
How do wakelocks work?,"Applications acquire and release wakelocks, and the kernel prevents power collapse while a wakelock is held."
What role does firmware play in power management during boot time?,"Firmware analyzes hardware and creates a device tree in RAM, which the kernel then uses to load drivers and manage devices."
What is ACPI?,"Advanced Configuration and Power Interface (ACPI) is an industry-standard firmware used in modern computers that provides callable routines for the kernel to manage device state, errors, and power."
Give an example of how ACPI is utilized by the kernel for device management.,"The kernel calls a device driver, which in turn calls ACPI routines, which then communicate with the device."
What is the primary role of the I/O subsystem?,To coordinate extensive services for applications and the kernel.
List some key areas supervised by the kernel I/O subsystem.,"Management of name space for files/devices, access control, operation control (e.g., a modem cannot `seek()`), file-system space allocation, device allocation, buffering, caching, spooling, I/O scheduling, device-status monitoring, error handling, failure recovery, device-driver configuration and initialization, and power management of I/O devices."
How do the upper levels of the I/O subsystem access devices?,Via a uniform interface provided by device drivers.
"How does an OS connect an application's request (e.g., reading a file) to hardware operations (e.g., disk sector access)?",The OS maps the application's file name reference through the file system's directory structure to specific space allocation on disk.
What is the initial step for an application referring to data?,It refers to data by file name.
What is the role of the file system in connecting application requests to hardware?,"The file system maps the file name, through directories, to space allocation on the disk."
How does MS-DOS (FAT) map a file name to disk blocks?,"The file name maps to a number, which indicates an entry in the file-access table, telling which disk blocks are allocated."
How does UNIX map a file name to disk blocks?,"The file name maps to an inode number, and the inode contains the space-allocation information."
How does MS-DOS identify hardware devices within a file name?,"The first part of the file name (before the colon), e.g., `C:`, identifies the hardware device."
"In MS-DOS, how is a device name like `C:` mapped to hardware?",It is mapped to a specific port address via a device table.
What is a key characteristic of the device name space in MS-DOS compared to its file-system name space?,"It is separate from the file-system name space, indicated by the colon separator (e.g., `C:`)."
What is an advantage of MS-DOS's separate device name space?,"It makes it easy to associate extra functionality, such as spooling for printer files."
How is the device name space handled in UNIX?,"It is incorporated into the regular file-system name space, with no clear separation of the device portion in the path name."
What is the purpose of the mount table in UNIX?,It associates path name prefixes with specific device names.
How does UNIX resolve a path name involving a device?,It looks up the path name in the mount table for the longest matching prefix.
What does a mount table entry provide after a successful lookup in UNIX?,A device name (which is also in the file-system name space).
What is found when a device name is looked up in UNIX?,"A `<major, minor>` device number, not an inode."
What does the major device number indicate?,It identifies the specific device driver responsible for handling I/O for that device.
What is the purpose of the minor device number?,It is passed to the device driver to index into its internal device table.
What information does a device-table entry provide?,The port address or memory-mapped address of the device controller.
How do modern operating systems enhance flexibility in device lookup?,They use multiple stages of lookup tables.
What is a benefit of the general mechanisms for passing requests between applications and drivers in modern OS?,New devices and drivers can be introduced without requiring kernel recompilation.
How do some operating systems manage loading device drivers?,They load device drivers on demand.
Describe driver loading during boot time.,"The system probes buses and loads necessary drivers, either immediately or upon the first request for the device."
How are drivers loaded for devices added after system boot?,"The device is detected, often by an error, the kernel inspects it, and then loads the driver dynamically."
What are some challenges associated with dynamic loading/unloading of drivers?,"It requires more complex kernel algorithms, careful device-structure locking, and robust error handling."
What is the first step in the life cycle of a blocking `read()` system call?,A process issues a blocking `read()` system call to a file descriptor of an opened file.
What is the kernel's first action after receiving a `read()` system call?,"The kernel system-call code checks parameters. If the data is already in the buffer cache, the data is returned and I/O completed."
What happens if the requested data is not in the buffer cache during a `read()` system call?,"Physical I/O is performed. The process is removed from the run queue and placed on a wait queue for the device, and the I/O request is scheduled."
What happens after an I/O request is scheduled by the kernel?,The I/O subsystem sends the request to the device driver (via subroutine call or in-kernel message).
What is the device driver's role in a blocking `read()` request after receiving the request?,"The device driver allocates kernel buffer space, schedules the I/O, and sends commands to the device controller by writing to device-control registers."
What is the device controller's responsibility during a `read()` request?,It operates the device hardware to perform the data transfer.
How can a driver handle data transfer completion from the device controller?,"The driver may poll for status/data, or set up a DMA transfer to kernel memory, where the DMA controller generates an interrupt upon transfer completion."
What happens immediately after a DMA transfer completes and an interrupt is generated?,"The correct interrupt handler receives the interrupt via the interrupt-vector table, stores the data, signals the device driver, and then returns."
What does the device driver do upon receiving a signal from the interrupt handler?,"It determines the completed I/O request and its status, then signals the kernel I/O subsystem."
What is the kernel's final action regarding data transfer and process state after being signaled by the device driver?,The kernel transfers the data and return codes to the requesting process's address space and moves the process from the wait queue to the ready queue.
What happens to the process after it is moved to the ready queue following a `read()` system call?,"Moving the process to the ready queue unblocks it. The scheduler then assigns the CPU, allowing the process to resume at the system call completion."
"Define ""mount table"".","An in-memory data structure containing information about each mounted volume, used to track file systems and access."
Which UNIX systems typically include the STREAMS mechanism?,UNIX System V and subsequent releases.
Define STREAMS.,A UNIX I/O feature allowing dynamic assembly of driver code pipelines.
"Define ""Stream"" in the context of STREAMS.",A full-duplex connection between a device driver and a user-level process.
What are the main components of a STREAMS mechanism?,"Stream head, driver end, and zero or more stream modules."
Define stream head.,The interface between STREAMS and user processes.
Define driver end.,The interface between STREAMS and the controlled device.
Define stream modules.,Modules of functionality loadable into a STREAM.
Where are stream modules positioned within a STREAMS connection?,Between the stream head and the driver end.
What type of queues does each component of a STREAMS mechanism contain?,A pair of queues: a read queue and a write queue.
How is data transferred between components in a STREAMS mechanism?,Via message passing between queues.
What is the function of modules in STREAMS?,They provide STREAMS processing functionality.
How are modules added (pushed) onto a stream?,Using the `ioctl()` system call.
Provide an example of using a module in STREAMS.,Opening a USB device (like a keyboard) via a stream and pushing a module for input editing.
Define flow control in STREAMS.,"A method to pause a sender of I/O, which limits the data flow rate."
How does a STREAMS queue behave when *without* flow control?,It accepts all messages and immediately sends them to the adjacent queue without buffering.
How does a STREAMS queue behave when *with* flow control?,It buffers messages and does not accept new messages without sufficient buffer space.
What is involved in flow control between adjacent STREAMS module queues?,Control message exchanges.
What system calls can a user process use to write data to a device via STREAMS?,`write()` or `putmsg()`.
What type of data does the `write()` system call handle in STREAMS?,Raw data (unstructured byte stream).
What additional capability does the `putmsg()` system call provide compared to `write()` in STREAMS?,It allows the user to specify a message.
What happens after a user process writes data to a stream head?,The stream head copies the data into a message and delivers it to the next module's queue.
What is the path of data after it leaves the stream head when writing to a device?,"Copying continues from module to module until it reaches the driver end, and then the device."
What system calls can a user process use to read data from a stream head?,`read()` or `getmsg()`.
How does the `read()` system call process data received from a stream head?,The stream head gets the message and returns ordinary data (an unstructured byte stream).
What type of data does the `getmsg()` system call return to the process?,The entire message.
What is the general nature of STREAMS I/O?,"Asynchronous (or nonblocking), except when communicating directly with the stream head."
When does a user process block when writing to a stream?,If the next queue in the stream uses flow control and there is no room to copy the message.
When does a user process block when reading from a stream?,Until data becomes available.
What is a key responsibility of the driver end regarding device interaction?,"It must respond to interrupts (e.g., when a frame is ready from a network device)."
How does the driver end's handling of incoming data differ from the stream head's?,"Unlike the stream head, which may block, the driver end *must* handle all incoming data."
Must drivers support flow control within the STREAMS mechanism?,"Yes, drivers must support flow control."
What often happens if a device's buffer becomes full when interacting via STREAMS?,"The device typically drops incoming messages (e.g., a network card dropping frames)."
What is a major benefit of the STREAMS mechanism?,It provides a framework for modular and incremental development of device drivers and network protocols.
What is an advantage regarding the reusability of STREAMS modules?,"Modules are reusable by different streams or devices (e.g., a networking module for Ethernet and 802.11 wireless)."
"What type of data and information can STREAMS support transfer between modules, beyond just unstructured byte streams?",Message boundaries and control information.
How widely adopted is STREAMS in UNIX variants and for what purpose?,Most UNIX variants support STREAMS; it is preferred for implementing protocols and device drivers.
Provide an example of a system where the socket mechanism is implemented using STREAMS.,System V UNIX and Solaris.
What is a major factor in system performance?,I/O
How do heavy I/O demands affect the CPU?,They place heavy demands on the CPU by requiring execution of device-driver code and scheduling processes (blocking/unblocking).
What is the impact of context switches during I/O on system components?,They stress the CPU and hardware caches.
What can be exposed by heavy I/O demands in the kernel?,Inefficiencies in the kernel's interrupt-handling mechanisms.
How does I/O activity load the memory bus?,Through data copies between controllers/physical memory and kernel buffers/application space.
What is a major concern for computer architects regarding I/O?,Graceful coping with I/O demands.
Why is interrupt handling considered relatively expensive?,"It involves a state change, execution of the handler, and restoration of the state."
Under what condition can Programmed I/O (PIO) be more efficient than interrupt-driven I/O?,If busy waiting is minimized.
What overhead results from I/O completion unblocking a process?,Full context switch overhead.
What is a characteristic of network traffic in terms of system overhead?,High context-switch rate.
"In a remote login, what is the sequence of events on the local machine when a character is typed?",Character typed → keyboard interrupt → interrupt handler → device driver → kernel → user process.
"In a remote login, describe the network I/O system call process initiated by the user on the local machine.",User process issues network I/O system call → local kernel → network layers (packet construction) → network device driver.
"In a remote login, what happens after the network device driver processes the packet on the local machine?","Network device driver transfers packet to controller → sends character, generates interrupt."
How does the network I/O system call complete on the local machine in a remote login scenario?,Interrupt back up through kernel → network I/O system call completes.
"In a remote login, what is the initial event on the remote system when a packet is received?",Network hardware receives packet → interrupt generated.
"In a remote login, what happens on the remote system after an interrupt is generated for a received packet?",Character is unpacked from protocols → passed to the appropriate network daemon.
"In a remote login, how does the network daemon process the character on the remote system?",Network daemon identifies session → passes packet to subdaemon.
What type of overhead is consistently observed throughout the remote login character example?,Context switches and state switches.
What is the impact of the receiver echoing a character in a remote login scenario?,It doubles the work.
What is one way some systems reduce the main CPU's interrupt burden for terminal I/O?,By using separate front-end processors.
What is the primary job of an I/O channel?,To offload I/O work from the main CPU and keep data flowing smoothly.
How do I/O channels process programs?,They process more general/sophisticated programs tuned for specific workloads.
List a principle to improve I/O efficiency related to context switches.,Reduce the number of context switches.
List a principle to improve I/O efficiency related to data copies in memory.,Reduce data copies in memory (between device/application).
List a principle to improve I/O efficiency related to interrupt frequency.,"Reduce interrupt frequency by using large transfers, smart controllers, or polling (if busy waiting is minimal)."
List a principle to improve I/O efficiency related to increasing concurrency.,Increase concurrency by using DMA-knowledgeable controllers/channels to offload data copying from the CPU.
List a principle to improve I/O efficiency related to hardware processing.,Move processing primitives into hardware to enable concurrent operation with the CPU/bus.
