Front,Back
List a principle to improve I/O efficiency related to system component balance.,"Balance CPU, memory subsystem, bus, and I/O performance, as overload in one area causes idleness in others."
How does the complexity of I/O devices vary?,"It varies significantly, from simple (e.g., mouse) to very complex (e.g., Windows disk driver)."
"What are some functions of a complex I/O device driver, such as a Windows disk driver?","Manages individual disks, implements RAID arrays, converts requests to disk I/O, performs error handling, data recovery, and optimizes performance."
What are the three main locations where I/O functionality can be implemented?,"Device hardware, device driver (kernel), or application software."
Where were experimental I/O algorithms initially implemented?,At the application level.
What are the advantages of implementing experimental I/O algorithms at the application level?,"Flexible, bugs are unlikely to crash the system, and no reboot/reload of drivers is needed after code changes."
What are the disadvantages of implementing experimental I/O algorithms at the application level?,"Innefficient due to context switch overhead, and lacks access to internal kernel data/functionality (e.g., messaging, threading, locking)."
What is an example of a system interface that allows user-mode file systems?,FUSE (Filesystem in Userspace).
Where are I/O algorithms typically reimplemented once they are proven?,In the kernel.
What is the main advantage of reimplementing I/O functionality in the kernel?,Improves performance.
What are the challenges of reimplementing I/O functionality in the kernel?,"More challenging development (due to large, complex kernel), and must be thoroughly debugged to avoid data corruption or system crashes."
Where is the highest I/O performance achieved?,Through specialized implementation in hardware (device or controller).
What are the disadvantages of implementing I/O functionality in hardware?,"Difficulty/expense of improvements/bug fixes, increased development time (months vs. days), and decreased flexibility (e.g., hardware RAID controller may not allow the kernel to influence I/O order/location)."
What is the current trend observed in I/O device speed?,"I/O devices are increasing in speed, with NVM devices nearing DRAM speed."
What is the impact of increasing I/O device speeds on system design and OS algorithms?,It increases pressure on I/O subsystems and OS algorithms to leverage the faster read/write speeds.
List the major components that affect the I/O performance of storage and network latency.,"CPU, caches, DRAM, NVM, PCIe, SSD, SAA, HDD."
"Define ""front-end processors.""",Small computers performing tasks in an overall system; they manage I/O and offload the main CPU.
"Define ""terminal concentrator.""",A type of front-end processor that multiplexes traffic from hundreds of remote terminals into one port.
"Define ""I/O channel.""","A dedicated, special-purpose CPU found in large systems (mainframes/high-end systems) used for I/O or offloading the main CPU."
What are the basic I/O hardware elements?,"Buses, device controllers, and devices."
How is data movement handled in an I/O system?,By the CPU (using programmed I/O) or by a DMA controller.
What is a device driver?,A kernel module responsible for controlling a specific hardware device.
What basic hardware categories does the system-call interface handle?,"Block devices, character-stream devices, memory-mapped files, network sockets, and programmed interval timers."
What is the typical behavior of system calls regarding processes?,System calls usually block processes.
When are nonblocking or asynchronous system calls used?,"By the kernel or applications that must not sleep (i.e., cannot afford to block)."
What services does the kernel's I/O subsystem provide?,"I/O scheduling, buffering, caching, spooling, device reservation, and error handling."
What is the purpose of name translation in I/O?,It connects hardware devices to symbolic file names.
What are the multiple mapping levels involved in I/O name translation?,"Character-string names map to device drivers/addresses, which then map to physical addresses (I/O ports/bus controllers)."
Where can I/O device mapping occur?,"Within the file-system name space (e.g., UNIX) or in a separate device name space (e.g., MS-DOS)."
What are STREAMS in UNIX?,A UNIX mechanism for the dynamic assembly of driver code pipelines.
How do drivers behave in a STREAMS pipeline?,"Drivers can be stacked, and data passes sequentially and bidirectionally through them."
Why are I/O system calls considered costly?,"Due to context switching (crossing the kernel protection boundary), signal/interrupt handling, and CPU/memory load for data copying between kernel buffers and application space."
