Front,Back
What are a computer's two main jobs?,I/O and computing.
"In many cases, which of a computer's main jobs is considered primary?","I/O is often primary, with computing being incidental (e.g., browsing, editing)."
What is the operating system's role concerning I/O?,To manage and control I/O operations and devices.
What aspect of I/O hardware is studied regarding OS internal facilities?,"I/O hardware basics, specifically constraints on OS internal facilities."
What two main areas concerning OS and applications are covered regarding I/O?,OS I/O services and application I/O interface.
"What ""gap"" is a key topic in I/O study?",Bridging the gap between hardware and application interfaces.
What is the UNIX System V STREAMS mechanism?,A mechanism for dynamic driver code pipelines.
What OS design principles are covered regarding I/O performance?,I/O performance and OS design principles for improvement.
What is a major concern in operating system design related to hardware?,Device control.
Why do I/O devices require varied control methods?,"Due to wide variations in their function and speed (e.g., mouse, hard disk, flash drive, tape robot)."
What OS component is formed by the varied I/O control methods?,The kernel's I/O subsystem.
What is a key benefit of the kernel's I/O subsystem?,It separates the kernel from device management complexities.
What is a trend in I/O device technology regarding software and hardware interfaces?,Increasing standardization of software/hardware interfaces.
What is the benefit of increasing standardization of I/O software/hardware interfaces?,It helps incorporate new device generations.
What is another trend in I/O device technology related to the diversity of devices?,An increasingly broad variety of I/O devices.
What challenge does the increasing variety of I/O devices pose?,"Incorporating new, unlike devices."
How do basic I/O hardware elements accommodate diverse devices?,"Elements like ports, buses, and device controllers are designed to accommodate diverse devices."
How is the kernel structured to manage diverse device details?,With device-driver modules that encapsulate device details.
What do device drivers provide to the I/O subsystem?,A uniform device-access interface.
What is the uniform device-access interface provided by device drivers analogous to?,System calls for applications.
Define: Device driver,An OS component providing uniform access and managing I/O to various devices.
What are the main types of device categories computers operate?,"Storage (disks, tapes), transmission (network, Bluetooth), and human-interface (screen, keyboard, mouse, audio)."
How do devices communicate with a computer?,Via signals over cable or air.
What is a 'port' in I/O hardware?,A connection point for devices to attach to computers.
What is a 'bus' in computer systems?,"A communication system connecting computer components (CPU, I/O devices) for data/command transfer; a set of wires with a rigidly defined protocol for messages (electrical voltages, timings)."
What is a 'daisy chain'?,"Devices connected in a string (A to B, B to C), usually operating as a bus."
How do buses vary?,"In signaling, speed, throughput, and connection."
What is the 'PCIe bus' and its purpose?,A common computer I/O bus connecting the processor-memory subsystem to fast devices.
What is an 'expansion bus' and its purpose?,"A computer bus for connecting slow devices (e.g., keyboards)."
What is 'Serial-attached SCSI (SAS)'?,"A common type of I/O bus, used to connect disks to a SAS controller."
What is 'SAS'?,Common type of I/O bus.
Describe a 'PCIe lane'.,Two signaling pairs (receive/transmit) forming a full-duplex byte stream.
What is the data packet format for PCIe?,"Eight-bit byte format, with simultaneous transmission in both directions."
What are the common physical link configurations for PCIe?,"1, 2, 4, 8, 12, 16, or 32 lanes (e.g., x8)."
Give an example of PCIe throughput based on generation and lanes.,PCIe gen3 x8 offers 8 GB/s throughput.
What is a 'controller' in I/O hardware?,"Electronics operating a port, bus, or device; a special processor managing I/O devices."
What is 'Fibre Channel (FC)'?,A storage I/O bus used in data centers to connect computers to storage arrays.
What is a 'host bus adapter (HBA)'?,A device controller installed in a host bus port for device connection.
What components does an HBA typically contain?,"A processor, microcode, and private memory for its specific protocol (e.g., FC protocol)."
Do all devices require external controllers?,"No, some devices, like disk drives, have built-in controllers."
What functions does a disk controller typically perform?,"It implements disk-side protocols (like SAS, SATA), contains microcode, and has a processor for tasks such as bad-sector mapping, prefetching, buffering, and caching."
How does a processor communicate with a controller?,"Via registers (data, control)."
What are the two primary methods for processor-controller communication?,Special I/O instructions and Memory-mapped I/O.
What is 'memory-mapped I/O'?,A device I/O method where device-control registers are mapped into the processor address space.
How does the CPU interact with device-control registers in memory-mapped I/O?,It uses standard data-transfer instructions to read or write to the registers at their mapped memory locations.
Why is memory-mapped I/O generally more efficient than special I/O instructions for large data transfers?,"Writing millions of bytes to memory-mapped regions (e.g., graphics memory) is faster than executing millions of individual I/O instructions."
What is the modern trend regarding I/O communication methods?,"Systems have moved towards memory-mapped I/O for efficiency, with most I/O today occurring via device controllers using this method."
What are the four typical I/O device control registers?,"Status, control, data-in, and data-out registers."
What is a 'data-in register'?,A device I/O register read by the host to get input data.
What is a 'data-out register'?,A device I/O register written by the host to send output data.
What is a 'status register'?,"A device I/O register whose bits are read by the host to indicate states such as command complete, byte available, or error."
What is a 'control register'?,"A device I/O register written by the host to start a command or change a device's mode (e.g., full/half-duplex, parity, word length, speed)."
What is the typical size of data registers?,1-4 bytes.
What are FIFO chips used for in controllers?,"They hold several bytes, expanding capacity and buffering data bursts."
What is 'handshaking' in host-controller interaction?,A coordinated exchange of signals or register bits between the host and controller to manage communication.
Describe the polling process for a host sending a byte to a device.,"1. Host reads `busy` bit until clear. 2. Host sets `write` bit in `command` register, writes byte to `data-out` register. 3. Host sets `command-ready` bit. 4. Controller notices `command-ready` set, sets `busy` bit. 5. Controller reads command, reads `data-out` byte, performs I/O. 6. Controller clears `command-ready`, clears `error` bit, clears `busy` bit."
What is 'busy waiting' or 'polling'?,"A thread or process continuously uses the CPU while waiting for an event; in I/O, it's an I/O loop where the I/O thread continuously reads the status waiting for I/O completion."
When is polling an efficient method for I/O?,"If the controller and device are very fast, or for basic operations (e.g., 3 CPU cycles)."
When is polling inefficient for I/O?,"If the wait is long and other CPU tasks are pending, or if the device is rarely ready, leading to wasted CPU cycles."
What is a risk associated with polling if the host waits too long?,Data loss due to buffer overflow.
What is the alternative to polling for a hardware controller to notify the CPU?,An interrupt.
What is an 'interrupt' in computer systems?,A hardware mechanism for a device to notify the CPU that it needs attention.
What is an 'interrupt-request line'?,A hardware connection to the CPU for signaling interrupts.
What is an 'interrupt-handler routine'?,An OS routine called when an interrupt signal is received.
Describe the basic mechanism of an interrupt.,"The CPU senses the interrupt-request line after each instruction. If a controller asserts the signal, the CPU saves its current state, jumps to an interrupt-handler routine at a fixed address. The handler determines the cause, processes it, restores the CPU state, and executes a 'return from interrupt' instruction."
What verbs describe the interrupt process from device to handler?,"A device controller *raises* an interrupt, the CPU *catches* and *dispatches* it, and the handler *clears* it."
What is 'interrupt-controller hardware'?,Computer hardware components for interrupt management.
What are the two types of interrupt request lines on a CPU?,Nonmaskable interrupt and Maskable interrupt.
What is a 'nonmaskable interrupt'?,"An interrupt that cannot be delayed or blocked (e.g., unrecoverable memory error)."
What does 'maskable' mean in the context of interrupts?,Describes an interrupt that can be delayed or blocked.
What is an 'interrupt vector'?,"An OS data structure indexed by interrupt address, pointing to handlers. Its purpose is to reduce the need for a single handler to search all sources."
What is 'interrupt chaining'?,A mechanism where an interrupt vector element points to a list of handlers; handlers are called until one services the request. This avoids a huge table and improves dispatch efficiency.
What is an 'interrupt priority level'?,"Prioritization of interrupts for handling order, allowing deferral of low-priority and urgent response to high-priority interrupts."
What is an 'exception'?,"A software-generated interrupt by error (e.g., division by zero, protected memory access) or a user program's request for an OS service."
What is a 'first-level interrupt handler (FLIH)'?,"An interrupt handler responsible for reception and queuing of interrupts, including context switch and state storage."
What is a 'second-level interrupt handler (SLIH)'?,An interrupt handler that performs the actual handling and processing of the interrupt.
What is a 'software interrupt'?,A software-generated interrupt; also called a trap.
What is a 'trap'?,"A software interrupt. It saves user state, switches to kernel mode, and dispatches to a kernel routine."
How are traps prioritized compared to device interrupts?,"Traps typically have low priority compared to device interrupts, as they are generally less urgent."
How are interrupts used in virtual memory paging?,"A page fault raises an interrupt, suspending the current process. The handler fetches the required page, and then schedules another process to run."
How do system calls typically initiate kernel routines?,Library routines build a data structure and then execute a software interrupt (trap) to switch to kernel mode and dispatch to the appropriate kernel routine.
What is 'programmed I/O (PIO)'?,A data transfer method where the CPU transfers data one byte at a time.
Why is PIO wasteful for large data transfers?,"It monopolizes the CPU for data movement, which is inefficient for large transfers like those to/from a disk."
What is 'direct memory access (DMA)'?,An operation allowing device controllers to transfer large data directly to/from main memory without involving the main CPU.
How is a DMA transfer initiated by the host CPU?,"The host writes a DMA command block (containing source, destination, and byte count) to memory, then provides the command block's address to the DMA controller and continues with other work."
What is 'scatter-gather' I/O?,An I/O method specifying multiple sources/destinations in one command block for a single transfer operation.
How does a DMA controller perform data transfers without the main CPU?,"It operates the memory bus directly, seizing it to perform transfers."
What is a challenge when DMA targets user space memory?,"Risk of modification during transfer, often leading to inefficient 'double buffering'."
What is 'double buffering'?,"Copying data twice (e.g., device to kernel, then kernel to process), or using two buffers."
What is the trend for direct I/O between devices and user address space?,Operating systems have moved to using memory-mapping to enable direct I/O transfers.
What are the handshaking signals between a DMA controller and a device controller?,DMA-request and DMA-acknowledge wires.
Describe the handshaking process during a DMA transfer.,"1. Device places a signal on the DMA-request line when a word is available. 2. DMA controller seizes the memory bus, places the address, and signals DMA-acknowledge. 3. Device receives DMA-acknowledge, transfers the word, and removes DMA-request. This repeats until done, then DMA controller interrupts the CPU."
What is 'cycle stealing'?,"A device (e.g., DMA controller) using the bus, temporarily preventing the CPU from accessing main memory."
What is the overall impact of cycle stealing on system performance?,"While it momentarily slows the CPU, DMA generally improves total system performance by offloading large data transfers."
What is 'direct virtual memory access (DVMA)'?,"DMA using virtual addresses as transfer sources/destinations, which are translated to physical addresses. It can also transfer between memory-mapped devices without CPU/main memory."
What are the key concepts of I/O hardware?,"Bus, Controller, I/O port and its registers, Handshaking (host and device controller), Handshaking execution (polling or interrupts), and Offloading large transfers to DMA controller."
What are the main challenges for OS implementers regarding I/O hardware?,"Managing the wide variety of devices with unique capabilities, control-bit definitions, and protocols; attaching new devices without OS rewrites; and providing a uniform I/O interface to applications."
What is a 'PHY'?,Physical hardware component connecting to a network (OSI layer 1).
What is the primary goal when designing the Application I/O interface?,To treat I/O devices uniformly.
What are the key approaches used to achieve uniform treatment of I/O devices?,"Abstraction, encapsulation, and software layering."
How are device differences abstracted away in the I/O system?,"By identifying general kinds of devices, each accessed via standardized functions."
What is an 'interface' in the context of I/O device access?,Standardized functions through which each kind of device is accessed.
What encapsulates device differences in the kernel?,Device drivers.
What are 'device drivers'?,Kernel modules custom-tailored to specific devices that export standard interfaces.
What is the purpose of the device-driver layer?,To hide differences among device controllers from the kernel I/O subsystem.
How do I/O system calls relate to hardware differences?,"They encapsulate device behavior in generic classes, hiding hardware differences from applications."
"What are the benefits of the I/O structuring techniques (abstraction, encapsulation, layering)?",Simplifies OS development and allows hardware manufacturers to design compatible devices or write drivers for popular OS.
List the dimensions along which I/O devices vary.,"Character-stream or block; sequential or random access; synchronous or asynchronous; sharable or dedicated; speed of operation; read-write, read only, or write once."
Define 'Character-stream' device.,A device that transfers bytes one by one.
Define 'Block' device.,A device that transfers a block of bytes as a unit.
Define 'Sequential access' for devices.,Data access in a fixed order determined by the device.
Define 'Random-access' for devices.,User can seek to any storage location directly.
Define 'Synchronous' I/O operation.,"Predictable response times, coordinated with the caller."
Define 'Asynchronous' I/O operation.,"Irregular/unpredictable response times, not coordinated with the caller."
Define 'Sharable' device.,A device that can be used concurrently by several processes/threads.
Define 'Dedicated' device.,A device that cannot be used concurrently by multiple processes/threads.
What are the different data transfer directions for I/O devices?,"Read-write (both input/output), Read only (only one data transfer direction), Write once (written once, then read-only)."
How does the OS simplify device access for applications?,"It hides many differences and groups devices into conventional types, providing major access conventions."
What are the major application access conventions for I/O?,"Block I/O, Character-stream I/O, Memory-mapped file access, Network sockets."
What is an 'escape' or 'back door' in the context of device interfaces?,A method of transparently passing arbitrary commands to a device driver when the interface lacks a standard method for specific functionality.
What UNIX system call serves as an 'escape' or 'back door'?,`ioctl()`.
What are the three arguments of the UNIX `ioctl()` system call?,"Device identifier (major/minor numbers), command integer, and a pointer to a data structure."
"What does the 'major number' signify in a device identifier (e.g., for `ioctl()`)?","The device type, which routes I/O requests to the appropriate driver."
"What does the 'minor number' signify in a device identifier (e.g., for `ioctl()`)?",The device instance (which specific device of that type).
What is a 'block-device interface'?,An interface for I/O to disk drives and other block-oriented devices.
What are common commands for a block-device interface?,"`read()`, `write()`, and `seek()` (for random-access devices)."
How do applications usually access block devices?,Via the file-system interface.
What is 'raw I/O'?,"Direct access to secondary storage as a linear array of blocks, bypassing the file system."
When might raw I/O be preferred?,By the OS or special applications like Database Management Systems (DBMS) to avoid extra buffering and redundant locking.
What is 'direct I/O'?,"A compromise mode on a file (e.g., in UNIX) that allows block I/O bypassing OS block features like buffering and locking."
How does memory-mapped file access work?,"It layers on block-device drivers, allowing access to disk storage via a byte array in main memory. A system call maps a file to memory and returns a virtual address."
What is a key efficiency of memory-mapped file access?,Data transfers only occur when needed (demand-paged virtual memory access).
What are the benefits of memory-mapped file access for programmers?,"It is convenient, allowing simple read/write operations to memory instead of using explicit I/O calls."
How is memory-mapped file access used by the kernel?,For kernel services such as executing programs and accessing swap space.
What is a 'character-stream interface'?,"An interface for I/O to character devices such as keyboards, mice, modems, printers, and audio boards."
What are the basic system calls for a character-stream interface?,`get()` and `put()` (one character at a time).
How is network I/O different from disk I/O?,It typically uses a different interface than `read()`-`write()`-`seek()`.
What is a 'network socket'?,"A common interface for network I/O, serving as an endpoint for communication (used in UNIX, Windows)."
List common system calls associated with the socket interface.,"Create socket, connect local socket to remote address, listen for remote application connection, send/receive packets, and `select()`."
What is the purpose of the `select()` system call in network I/O?,"It manages a set of sockets, returning information on which sockets are ready (e.g., packet waiting, room to send), eliminating polling/busy waiting."
What are the benefits of the socket interface?,It facilitates distributed applications using any network hardware/protocol.
"Besides sockets, what are other approaches for Inter-Process Communication (IPC) and network communication?","Half-duplex pipes, full-duplex FIFOs, full-duplex STREAMS, and message queues."
What functionalities do hardware clocks and timers provide?,"Current time, elapsed time, and the ability to set a timer for operation X at time T."
What is a 'programmable interval timer'?,"Hardware (often provided by CPUs) used to measure elapsed time and trigger operations, typically by generating an interrupt (once or periodically)."
How is a programmable interval timer used by the OS?,"By the scheduler to preempt processes, by disk I/O to flush dirty caches, and by the network to cancel slow operations."
How does the OS manage more timer requests than available hardware channels?,It simulates virtual clocks by maintaining a sorted list of wanted interrupts and setting the hardware timer for the earliest pending request.
What is a 'high-performance event timer (HPET)'?,"A modern hardware timer (provided by some CPUs on PCs) often operating in the 10-megahertz range, with comparators that trigger interrupts when a value matches the HPET."
What limits precision in timer operations?,Timer resolution and virtual clock overhead.
What is 'network time protocol (NTP)'?,A network protocol used for synchronizing system clocks.
Define a 'blocking' system call.,"An I/O request that suspends the calling thread, moving it to a wait queue, until the I/O operation completes."
What is the nature of physical I/O actions in terms of timing?,"They are generally asynchronous, with varying and unpredictable completion times."
Why does the OS typically provide blocking I/O calls for applications?,Because they are easier for application developers to write and manage.
When is nonblocking I/O needed by user processes?,"For applications that cannot afford to halt, such as user interfaces or video applications, to overlap execution with I/O."
How can multithreaded applications overlap execution with I/O?,Some threads can block on I/O while others continue to execute.
What is a 'nonblocking' I/O system call?,"An I/O request that returns quickly, indicating the bytes transferred (full, fewer, or none), and does not halt the calling thread."
What is an 'asynchronous' system call?,"An I/O request that returns immediately without waiting for the I/O to complete, allowing the calling thread to continue execution."
How is I/O completion communicated for asynchronous system calls?,"Via variable setting, a signal/software interrupt, or a callback mechanism."
What is the key difference between a nonblocking `read()` and an asynchronous `read()`?,"A nonblocking `read()` returns immediately with any available data (full, fewer, or none), while an asynchronous `read()` requests the full transfer to complete later, returning immediately without data."
How does OS buffering optimize I/O performance?,"The OS buffers I/O and returns control to the application, completing the request later, which can hide I/O latency."
How is data consistency ensured when the OS buffers I/O?,"The kernel reads from its buffers before performing I/O, ensuring that the correct data is returned to the reader."
What mechanism can be used with `select()` for nonblocking behavior in network sockets?,"Specifying a maximum waiting time, with '0' indicating polling behavior (returning immediately if no I/O is possible)."
What is the overhead associated with using `select()`?,`select()` only checks if I/O is possible; subsequent `read()`/`write()` calls are still needed to perform the actual data transfer.
What is 'Vectored I/O'?,One system call that performs multiple I/O operations involving multiple memory locations.
What UNIX system call implements Vectored I/O?,"`readv` (and `writev`), which accepts a vector of multiple buffers to read to or write from."
What is another name for Vectored I/O?,Scatter-gather.
What are the benefits of Vectored I/O?,"Avoids context-switching and system-call overhead, eliminates the need to transfer data to a larger contiguous buffer first, and can provide atomicity (all I/O done without interruption, avoiding data corruption)."
What are some key I/O-related services provided by the kernel's I/O subsystem?,"Scheduling, buffering, caching, spooling, device reservation, and error handling."
On what infrastructure does the kernel's I/O subsystem build?,Hardware and device-driver infrastructure.
What is a key responsibility of the I/O subsystem regarding processes and users?,Protecting itself from errant processes and malicious users.
What is the primary purpose of I/O scheduling?,To determine a good execution order for I/O requests.
"Why is I/O scheduling necessary, considering the order of application system calls?",The order of application system calls is rarely the best for overall system performance.
What are the benefits of I/O scheduling?,"Improve overall system performance, fair device access, and reduce average waiting time."
How is I/O scheduling typically implemented?,By maintaining a wait queue for each I/O device.
What happens when a blocking I/O system call is made?,The request is placed on the device's wait queue.
How does the I/O scheduler optimize the device queue?,It rearranges the queue for efficiency and to reduce average response time.
Can the OS prioritize certain I/O requests? Provide an example.,"Yes, the OS may prioritize delay-sensitive requests, such as those from the virtual memory subsystem over applications."
What is a 'device-status table'?,A kernel data structure that tracks the status and queues of operations for I/O devices.
What information is typically stored in an entry of a device-status table?,"Device type, address, and state (e.g., not functioning, idle, busy)."
What additional information is stored in a device-status table entry if the device is busy?,The request type and parameters of the current operation.
"Besides improving efficiency, what else does scheduling I/O operations enable the OS to use?","Storage space in main memory/storage hierarchy via buffering, caching, and spooling."
