Front,Back,Reversible
What is virtual memory?,A technique allowing execution of a process not completely in memory; it separates logical memory from physical memory.,y
What is the major advantage of virtual memory?,It allows programs to be larger than physical memory.,y
How does virtual memory abstract main memory?,"Into a large, uniform storage array.",y
What two types of memory does virtual memory separate?,Logical memory (programmer's view) from physical memory.,y
What benefit does virtual memory provide to programmers regarding memory constraints?,"It frees programmers from memory-storage limitations, allowing them not to worry about physical memory limits.",y
"Beyond basic execution, what capabilities does virtual memory allow processes to do?","Share files, libraries, and implement shared memory.",y
What is the impact of virtual memory on process creation?,It provides an efficient mechanism for process creation.,y
What is a potential downside of virtual memory implementation?,It can be complex and decrease performance if used carelessly.,y
What was the primary limitation of traditional memory management?,"The entire process had to be in physical memory for execution, limiting program size to physical memory.",y
Why do real programs often not need their entire code loaded into memory?,"Because parts like error handling code are seldom executed, arrays/lists are often allocated more memory than needed, and rare program options/features are rarely used.",y
"List the benefits of executing only parts of a program in memory (i.e., using virtual memory).","1. Programs are not constrained by physical memory size, allowing for a large virtual address space. 2. Less physical memory is required per program, leading to more programs running concurrently, which increases CPU utilization and throughput (without increasing response/turnaround time). 3. Less I/O is needed for loading/swapping, resulting in faster program execution.",y
Define 'virtual address space'.,A logical view of how a process is stored in memory. It typically presents the process as starting at logical address 0 with contiguous memory.,y
How is physical memory organized when using virtual memory?,"In page frames, which are not necessarily contiguous.",y
What is the function of the Memory-Management Unit (MMU)?,It maps logical pages to physical page frames.,y
How do the heap and stack typically grow within a process's virtual address space?,"The heap grows upward, and the stack grows downward.",y
What is the significance of the large blank space often found between the heap and stack in a virtual address space?,It is part of the virtual address space but only requires physical pages if the heap or stack grows into it.,y
What does it mean for an address space to be 'sparse'?,"It describes an address space with many 'holes' or a page table with noncontiguous, scattered entries.",y
What are the benefits of sparse address spaces?,1. Holes can be filled as the stack or heap grows. 2. They facilitate dynamic linking of libraries or shared objects during execution.,y
"How does virtual memory allow system libraries (e.g., standard C library) to be shared by multiple processes?","By mapping them into the virtual address space of processes. These libraries are typically mapped read-only, allowing their physical pages to be shared among processes.",y
How does virtual memory enable inter-process communication?,Processes can share memory regions for communication.,y
"How does virtual memory speed up process creation, particularly with `fork()`?",By allowing pages to be shared between the parent and child process initially.,y
How does Linux manage virtual memory?,Using demand paging.,y
How does Linux allocate pages?,From a list of free frames.,y
What is Linux's page-replacement policy?,A global policy similar to the LRU-approximation clock algorithm (second-chance).,y
What are the two page lists maintained by Linux for virtual memory management?,`active_list` and `inactive_list`.,y
What is the purpose of the `active_list` in Linux's virtual memory management?,It contains pages considered in use.,y
What is the purpose of the `inactive_list` in Linux's virtual memory management?,"It contains pages not recently referenced, which are eligible for reclamation.",y
"What specific bit is associated with each page in Linux's virtual memory system, and what is its function?","An `accessed` bit, which is set when the page is referenced.",y
"In Linux, what happens when a page is first allocated regarding its `accessed` bit and list placement?","Its `accessed` bit is set, and it's added to the rear of the `active_list`.",y
"If a page in the `active_list` is referenced in Linux, what actions are taken?","Its `accessed` bit is set, and it moves to the rear of the `active_list`.",y
What periodic action does Linux perform on the `accessed` bits of pages in the `active_list`?,The `accessed` bits for pages in the `active_list` are periodically reset.,y
"In Linux, what happens to the least recently used page at the front of the `active_list`?",It may migrate to the rear of the `inactive_list`.,y
What happens in Linux if a page in the `inactive_list` is referenced?,It moves back to the rear of the `active_list`.,y
How does Linux maintain a balance between the `active_list` and `inactive_list`?,"The lists are kept in relative balance. If the `active_list` grows larger than the `inactive_list`, pages from the front of the `active_list` move to the `inactive_list` (making them eligible for reclamation).",y
What is the name of the page-out daemon process in the Linux kernel?,`kswapd`.,y
What is the function of the `kswapd` process in Linux?,"It periodically awakens, checks free memory, and if free memory falls below a threshold, it scans the `inactive_list` and reclaims pages for the free list.",y
Which system architectures does Windows 10 support for virtual memory management?,"32-bit and 64-bit systems (Intel, ARM).",y
What are the default virtual address space and physical memory limits for 32-bit Windows systems?,A default 2 GB virtual address space (extendable to 3 GB) and 4 GB physical memory.,y
What are the virtual address space and physical memory limits for 64-bit Windows systems?,"128-TB virtual address space, and up to 24 TB physical memory (Windows Server up to 128 TB).",y
What virtual memory management features are implemented in Windows?,"Shared libraries, demand paging, copy-on-write, paging, and memory compression.",y
What is the primary mechanism for virtual memory in Windows?,Demand paging with clustering.,y
Define 'clustering' in the context of Windows virtual memory.,Paging in a group of contiguous pages when a single page is requested via a page fault.,y
What is the typical cluster size for a data page fault in Windows?,3 pages (the faulting page + one immediately preceding + one immediately following).,y
What is the typical cluster size for other types of page faults in Windows?,7 pages.,y
What is a key component of Windows' virtual memory management?,Working-set management.,y
What are the default working-set minimum and maximum pages assigned to a process upon creation in Windows?,Working-set minimum (50 pages) and working-set maximum (345 pages).,y
Define 'working-set minimum' in Windows.,The minimum number of frames guaranteed to a process in memory.,y
Define 'working-set maximum' in Windows.,The maximum number of frames allowed to a process if sufficient memory is available.,y
Define 'hard working-set limits' in Windows.,"The maximum amount of physical memory a process is allowed to use. (Note: if configured, these values may be ignored.)",y
Can a process in Windows grow beyond its working-set maximum?,"Yes, if sufficient memory is available.",y
Can memory allocated to a process in Windows shrink below its working-set minimum?,"Yes, this can occur during periods of high memory demand.",y
"What page replacement algorithm does Windows use, and what policies does it incorporate?",An LRU-approximation clock algorithm (second-chance) with both local and global policies.,y
What does the Virtual Memory Manager in Windows maintain to assist with page allocation?,A free page frames list with a threshold.,y
"In Windows, what happens if a process experiences a page fault while operating below its working-set maximum?",A page is allocated from the free list.,y
"In Windows, if a process is at its working-set maximum, but sufficient memory is available, what happens upon a page fault?","A free page is allocated, allowing the process to grow beyond its working-set maximum.",y
What action does the Windows kernel take if there is insufficient free memory during a page fault?,The kernel selects a page from the faulting process's working set for replacement (using a local LRU policy).,y
What global replacement tactic does Windows employ if free memory falls below a threshold?,`automatic working-set trimming`.,y
Define 'automatic working-set trimming' in Windows.,The process of decreasing working-set frames for processes if a minimum free memory threshold is reached.,y
How does automatic working-set trimming operate in Windows when a process holds more pages than its working-set minimum?,It removes pages until sufficient memory is available or the process reaches its working-set minimum.,y
Which types of processes are prioritized for trimming during automatic working-set trimming in Windows?,"Larger, idle processes are targeted before smaller, active processes.",y
To what extent does automatic working-set trimming persist in Windows?,"It continues until sufficient free memory is achieved, even if processes shrink below their working-set minimum.",y
Which categories of processes does Windows perform trimming on?,Both user-mode and system processes.,y
What happens in Solaris when a thread incurs a page fault?,The kernel assigns a page from the free list.,y
What is the `lotsfree` parameter in Solaris?,A threshold (typically 1/64 of physical memory) at which the kernel begins paging.,y
How often does the Solaris kernel check free memory against the `lotsfree` parameter?,Four times per second.,y
When does the `pageout` process initiate in Solaris?,If the number of free pages falls below the `lotsfree` threshold.,y
What algorithm does the `pageout` process in Solaris employ?,"An algorithm similar to the second-chance algorithm, utilizing two 'hands'.",y
What is the role of the 'front hand' in the Solaris `pageout` process?,It scans all pages and sets their reference bit to 0.,y
What is the role of the 'back hand' in the Solaris `pageout` process?,"It examines the reference bit; if it is still 0, the page is appended to the free list and written to secondary storage if modified.",y
How does Solaris manage minor page faults?,A process can reclaim a page from the free list if it was accessed before being reassigned.,y
What parameter controls the rate at which pages are scanned by the Solaris `pageout` algorithm?,"The `scanrate` parameter, which specifies pages per second.",y
What is the range for the `scanrate` in Solaris?,From `slowscan` to `fastscan`.,y
"What is the default `slowscan` rate in Solaris, and when is it typically applied?","100 pages/sec, applied when free memory falls below `lotsfree`.",y
What is the maximum `fastscan` rate in Solaris?,"Total physical pages/2, with a maximum of 8,192 pages/sec (depending on free memory levels).",y
What system parameter determines the distance between the two hands in the Solaris `pageout` algorithm?,The `handspread` system parameter.,y
How is the time interval between clearing and checking a page's reference bit determined in Solaris?,It depends on the `scanrate` and `handspread` parameters.,y
How frequently does the Solaris `pageout` process check memory conditions?,Four times per second.,y
Under what condition does the Solaris `pageout` process run 100 times per second?,If free memory falls below `desfree` (desired free memory).,y
What is the primary objective of the `desfree` parameter in Solaris?,To ensure that at least `desfree` memory is kept available.,y
What action does the Solaris kernel take if it cannot maintain `desfree` memory for a 30-second average?,"The kernel swaps processes (freeing all their pages), typically targeting idle processes.",y
When is the `pageout` process called for every new page request in Solaris?,If the system is unable to maintain `minfree`.,y
What specific types of pages does the Solaris page-scanning algorithm skip during reclamation?,"Shared library pages, even if they would otherwise be eligible for reclamation.",y
How does the Solaris page-scanning algorithm distinguish between different types of pages for reclamation?,"It distinguishes between pages for processes and regular data files, a process known as `priority paging`.",y
Define 'priority paging' in Solaris.,"Prioritizing the selection of victim frames based on specific criteria, such as avoiding shared library pages.",y
What is virtual memory?,Abstracts physical memory into an extremely large uniform array of storage.,y
Name one benefit of virtual memory related to program size.,Program can be larger than physical memory.,y
Name one benefit of virtual memory related to program loading.,Program does not need to be entirely in memory.,y
Name one benefit of virtual memory related to process interaction.,Processes can share memory.,y
Name one benefit of virtual memory related to process creation.,Processes can be created more efficiently.,y
Define Demand paging.,Pages are loaded only when demanded during program execution.,y
"In demand paging, what happens to pages that are never demanded?",Pages never demanded are never loaded.,y
What is a page fault?,Occurs when a page not in memory is accessed.,y
What action must be taken when a page fault occurs?,The page must be brought from the backing store into an available page frame.,y
Define Copy-on-write.,A mechanism where a child process shares the same address space as its parent.,y
Under what condition is a copy of a page made in a copy-on-write system?,If the child or parent modifies the shared page.,y
When are page-replacement algorithms used?,"When available memory is low, a page-replacement algorithm selects an existing page to replace.",y
Name common page-replacement algorithms.,"FIFO, optimal, LRU.",y
Why is pure LRU impractical to implement?,Most systems use LRU-approximation algorithms instead.,y
Define Global page-replacement algorithms.,Algorithms that select a page from any process for replacement.,y
Define Local page-replacement algorithms.,Algorithms that select a page only from the faulting process for replacement.,y
What is Thrashing?,A state where the system spends more time paging than executing.,y
Define Locality (in the context of memory management).,A set of pages actively used together.,y
How does process execution typically behave with regard to locality?,Process execution moves from locality to locality.,y
What is a Working set?,"Based on locality, it's the set of pages currently in use by a process.",y
What is Memory compression?,A technique that compresses a number of pages into a single page.,y
When is memory compression used as an alternative to paging?,On mobile systems without paging support.,y
How is Kernel memory allocation different from user-mode process memory allocation?,"Kernel memory is allocated differently, in contiguous chunks of varying sizes.",y
Name two common techniques for kernel memory allocation.,Buddy system and Slab allocation.,y
What is TLB reach?,The amount of memory accessible from the Translation Lookaside Buffer (TLB).,y
How is TLB reach calculated?,Number of entries in TLB × page size.,y
What is a technique to increase TLB reach?,Increase the page size.,y
"How do Linux, Windows, and Solaris manage virtual memory?","They manage it similarly, using demand paging, copy-on-write, and variations of LRU approximation (e.g., clock algorithm).",y
What is one traditional method for program loading?,Loading the entire program into physical memory at execution.,y
What is a problem with loading an entire program into physical memory at execution?,"The entire program may not be needed initially (e.g., unselected options), leading to inefficient memory use.",y
What is an alternative to loading an entire program into physical memory at execution?,"Loading pages only as needed, which is called demand paging.",y
When are pages loaded into physical memory in a demand paging system?,Only when they are 'demanded' during execution.,y
What happens to unaccessed pages in a demand paging system?,They are never loaded into physical memory.,y
What is demand paging similar to?,Paging with swapping.,y
What is a key benefit of demand paging?,More efficient memory use by loading only the needed portions of a program.,y
What hardware support is needed to distinguish between pages in memory and pages in secondary storage?,A valid-invalid bit scheme for page table entries.,y
"In a valid-invalid bit scheme, what does a 'valid' bit indicate?",That the associated page is legal and currently in memory.,y
"In a valid-invalid bit scheme, what does an 'invalid' bit indicate?",That the associated page is either not valid (not in the logical address space) or is valid but currently located in secondary storage.,y
What happens if a process attempts to access a page marked as 'invalid' in the page table?,A 'page fault' occurs.,y
What does a page fault cause?,A trap to the operating system (OS).,y
What is the first step in the page fault handling procedure?,Check an internal table (like the process control block) to determine if the memory access is valid or invalid.,y
"In page fault handling, what happens if the memory access is determined to be invalid?",The process is terminated.,y
"In page fault handling, what happens if the memory access is valid but the page is not in memory?",The operating system initiates the process to bring the page into memory.,y
"After determining a valid but non-resident page, what is the next step in page fault handling?",Find a free frame in physical memory.,y
What happens after a free frame is found during page fault handling?,A secondary storage operation is scheduled to read the required page into the new free frame.,y
What happens after the storage read is complete during page fault handling?,The internal table and the page table are modified to indicate that the page is now in memory.,y
What is the final step in the page fault handling procedure?,"The interrupted instruction is restarted, allowing the process to access the page as if it had always been in memory.",y
What is 'pure demand paging'?,"A form of demand paging where a process starts with no pages in memory, and pages are brought in only as they are faulted for.",y
Why does demand paging generally have reasonable performance?,Because programs tend to exhibit 'locality of reference'.,y
What two main hardware components are crucial for demand paging?,The page table and secondary memory (swap device/swap space).,y
What is the role of the page table in demand paging hardware support?,It marks entries as invalid using valid-invalid bits or protection bits.,y
What is the role of secondary memory in demand paging hardware support?,"It holds pages that are not currently in main memory, often referred to as swap space or a swap device.",y
What is a crucial requirement for an operating system supporting demand paging related to instructions?,The ability to restart any instruction after a page fault occurs.,y
What process state information must be saved on a page fault to allow instruction restart?,"Registers, condition code, and the instruction counter.",y
"What is a difficulty encountered with restarting instructions after a page fault, especially for older architectures?","Instructions that modify multiple locations, like the IBM System 360/370 MVC instruction.",y
What is one solution for restarting instructions that modify multiple locations after a page fault?,"Microcode accessing both ends of blocks before modification, ensuring a fault happens before any modification.",y
What is another solution for restarting instructions that modify multiple locations after a page fault?,Using temporary registers to store overwritten values and restoring old values on a fault before the trap.,y
How should paging appear to a running process?,It should be transparent to the process.,y
What does the operating system maintain to handle page faults and memory allocation?,A free-frame list.,y
"Besides page faults, for what other purposes are free frames allocated from the free-frame list?",For stack and heap segment expansion.,y
What is 'zero-fill-on-demand'?,A technique used by most operating systems where frames are 'zeroed-out' (filled with zeros) before being allocated to a process.,y
What is the purpose of 'zero-fill-on-demand'?,To ensure security by preventing a process from accessing the previous contents of a frame.,y
What is the state of the free-frame list at system startup?,All available memory is placed on the free-frame list.,y
What happens to the free-frame list as requests for memory frames are made?,It shrinks and must be repopulated when its size becomes low.,y
What is the formula for calculating the effective access time for demand-paged memory?,"Effective Access Time = (1 - p) * ma + p * page fault time, where 'p' is the probability of a page fault and 'ma' is the memory access time.",y
What are the three main components of page fault service time?,"Servicing the page-fault interrupt, reading in the page from secondary storage, and restarting the process.",y
What is the typical time range for servicing a page-fault interrupt and restarting the process?,1 to 100 microseconds.,y
What is the approximate HDD page-switch time?,"Around 8 milliseconds (composed of ~3ms latency, ~5ms seek, and ~0.05ms transfer).",y
How does the effective access time relate to the page-fault rate?,It is directly proportional to the page-fault rate.,y
"What is the impact on performance if the page-fault rate is 1/1000, given a memory access time of 200 ns and a page-fault service time of 8 ms?","The effective access time would be 8.2 microseconds, representing a 40x slowdown.",y
What condition is crucial for good demand-paging performance?,A very low page-fault rate.,y
How does swap space I/O generally compare to file system I/O?,Swap space I/O is generally faster than file system I/O because it typically uses larger blocks and avoids file lookups.,y
Describe one strategy for swap space usage where the entire file image is copied.,"The entire file image is copied to swap space at startup, and then pages are demand-paged from this swap space. (Disadvantage: initial copy time).",y
Describe a common swap space usage strategy used by Linux and Windows.,"Pages are initially demand-paged directly from the file system, but if they are modified and later replaced, they are written to swap space.",y
How do Linux and BSD UNIX handle demand paging for binary executables?,"They demand-page binary executables directly from the file system. If frames holding these pages are replaced, they are simply overwritten (as they are never modified), with the file system acting as the backing store.",y
"What type of memory still typically uses swap space, regardless of the executable paging strategy?",Anonymous memory (such as stack and heap).,y
How do mobile operating systems like iOS typically handle memory and swapping?,"They typically do not use swapping. Instead, they demand-page from the file system and reclaim read-only pages if memory becomes constrained.",y
"How are anonymous memory pages handled in mobile OS like iOS, given they typically don't swap?",They are not reclaimed unless the application is terminated or explicitly releases the memory.,y
What is an alternative to swapping in mobile systems?,Compressed memory.,y
Define 'demand paging'.,Bringing in pages from storage as needed rather than entirely at process load time.,y
Define 'page fault'.,A fault that occurs when a reference is made to a non-memory-resident page.,y
Define 'pure demand paging'.,A specific type of demand paging where no page is brought into memory until it is referenced.,y
Define 'locality of reference'.,The tendency of processes to reference memory in predictable patterns rather than randomly.,y
Define 'swap space'.,The secondary storage backing-store space used for memory pages that have been paged out of physical memory.,y
Define 'free-frame list'.,A kernel-maintained list of available free physical memory frames.,y
Define 'zero-fill-on-demand'.,"The process of writing zeros into a page before making it available to a process, typically for security reasons.",y
Define 'effective access time'.,"The measured or calculated time required to access a resource, such as memory.",y
Define 'page-fault rate'.,A measure of how often a page fault occurs per memory access attempt.,y
Define 'anonymous memory'.,"Memory that is not associated with a file; if it becomes dirty and needs to be paged out, it is stored in swap space.",y
What is a characteristic of `fork()` regarding demand paging?,Process creation using `fork()` can bypass demand paging initially.,y
What technique is Copy-on-write similar to for rapid process creation?,Page sharing.,y
What is the primary goal of Copy-on-write in process creation?,To minimize new pages allocated to the child process.,y
How did traditional `fork()` behave regarding the parent's address space?,"Traditionally, `fork()` copied the parent's entire address space for the child.",y
When might copying the parent's address space for the child be unnecessary?,If the child immediately calls `exec()`.,y
Define Copy-on-write (concept).,"Parent and child processes initially share the same pages; if either process writes to a shared page, a copy of that page is created.",y
How are pages marked when Copy-on-write is in effect?,Shared pages are marked as copy-on-write.,y
