Front,Back,Reversible
What happens when a process writes to a shared page marked copy-on-write?,"A copy of the shared page is created, and the write operation occurs on the new copy.",y
Describe the process when a child modifies a copy-on-write stack page.,"The OS gets a free frame, copies the original page to it, and maps the copied page to the child's address space. The child then modifies its new, copied page, not the parent's.",y
"Which pages are copied when using Copy-on-write, and which can remain shared?","Only modified pages are copied; unmodified pages (e.g., executable code) can continue to be shared.",y
In which operating systems is Copy-on-write a common technique?,"Windows, Linux, macOS.",y
What is `vfork()`?,"A variation of `fork()` found in UNIX systems (Linux, macOS, BSD UNIX).",y
How does `vfork()` differ from `fork()` in terms of address space sharing and Copy-on-write?,"With `vfork()`, the parent process is suspended, and the child directly uses the parent's address space. `vfork()` does not use copy-on-write.",y
What is a critical consequence of a child process modifying the parent's address space when using `vfork()`?,Changes made by the child process to the parent's address space will be visible to the parent upon its resumption.,y
What caution should be exercised when using `vfork()`?,The child process must not modify the parent's address space.,y
What is the intended use case for `vfork()`?,It is intended for use when the child process calls `exec()` immediately after creation.,y
What is the efficiency characteristic of `vfork()` process creation?,It is extremely efficient because no page copying is involved.,y
For what specific application is `vfork()` sometimes used?,To implement UNIX command-line shell interfaces.,y
Define: copy-on-write,"A technique where a write operation causes data to be copied then modified; specifically, on a shared page write, the page is copied, and the write occurs to the copy.",y
Define: virtual memory fork,"Refers to the `vfork()` system call, where the child process shares the parent's address space for read/write access, and the parent process is suspended during this time.",y
What is the primary benefit of demand paging in terms of I/O?,Demand paging saves I/O by loading only used pages.,y
How can the degree of multiprogramming be increased using memory management techniques?,By over-allocating memory.,y
Explain the concept of 'over-allocating' memory.,Providing access to more resources than physically available; allocating more virtual memory than physical memory.,y
What problem can arise from over-allocating memory?,"Processes may suddenly need all pages (e.g., 60 frames needed, only 40 available).",y
How does over-allocation manifest in a system?,As a page fault with no free frames.,y
"What additional system component uses memory, increasing strain on memory-placement?",I/O buffers.,y
What action is taken if there are no free frames during a page fault?,A frame not in use is found and freed.,y
Describe the process of freeing a frame.,Write its contents to swap space and change the page table to indicate the page is no longer in memory.,y
What is the purpose of 'page replacement'?,Selection of a physical memory frame to be replaced when a new page is allocated.,y
"In the modified page-fault service routine, what is the first step?",Find the desired page on secondary storage.,y
"In the modified page-fault service routine, if no free frame is available, what is selected?","A victim frame, using a page-replacement algorithm.",y
What is a 'victim frame'?,The frame selected by the page-replacement algorithm to be replaced.,y
What happens to a victim frame if it has been modified?,Its contents are written to secondary storage before replacement; page/frame tables are updated.,y
How does page-fault service time change if no free frames are available?,"It doubles due to two page transfers (page-out for victim, page-in for desired page).",y
What is used to reduce overhead in page replacement when a page is unchanged?,A modify bit (or dirty bit).,y
What is a 'modify bit' (or 'dirty bit')?,An MMU bit indicating a frame has been modified (must be saved before replacement).,y
When is the modify bit set?,Hardware sets the modify bit if the page has been written to.,y
What is the advantage of a modify bit being unset when a page is replaced?,"No need to write the page to storage (because it's unchanged), significantly reducing page-fault service time.",y
How does page replacement relate to logical and physical memory?,"It separates logical and physical memory, allowing enormous virtual memory on smaller physical memory.",y
What are the two major problems for demand paging?,1. Frame-allocation algorithm (how many frames to allocate to each process). 2. Page-replacement algorithm (which frames to replace).,y
What is a 'frame-allocation algorithm'?,An OS algorithm for allocating frames among all demands.,y
What is a 'page-replacement algorithm'?,An algorithm choosing which victim frame will be replaced by a new data frame.,y
What is the primary goal of a page replacement algorithm?,To achieve the lowest page-fault rate.,y
How are page replacement algorithms evaluated?,Using a reference string (a trace of memory accesses).,y
What is a 'reference string'?,A trace of accesses to a resource; a list of pages accessed over time.,y
What simplification is typically made when creating a reference string?,"Only the page number is recorded, and immediate repeated references are ignored.",y
What is the general relationship between the number of allocated frames and the page-fault rate?,More frames generally lead to fewer page faults.,y
"Describe the First-in, First-out (FIFO) page replacement algorithm.","It replaces the oldest page, meaning the first one brought into memory.",y
How can the FIFO page replacement algorithm be implemented?,"Using a FIFO queue: replace the page at the head, and insert the new page at the tail.",y
What are the advantages of the FIFO page replacement algorithm?,It is easy to understand and program.,y
What is a common performance issue with the FIFO page replacement algorithm?,"It may replace actively used pages, leading to increased page-fault rates and slowed execution.",y
What is 'Belady's anomaly'?,A phenomenon where the page-fault rate may increase as the number of allocated frames increases for some algorithms.,y
Which page replacement algorithm suffers from Belady's anomaly?,FIFO page replacement.,y
What is the 'optimal page-replacement algorithm' (OPT or MIN)?,"The algorithm with the lowest page-fault rate, which never suffers from Belady's anomaly.",y
What is the rule for the Optimal (OPT) page replacement algorithm?,Replace the page that will not be used for the longest period of time.,y
What is the primary difficulty in implementing the Optimal page replacement algorithm?,"It requires future knowledge of the reference string, which is impossible in practice.",y
What is the main use of the Optimal page replacement algorithm?,Mainly for comparison studies to evaluate other algorithms.,y
What algorithm does the Least Recently Used (LRU) algorithm approximate?,The optimal page-replacement algorithm.,y
Describe the rule for the 'Least Recently Used (LRU)' algorithm.,It replaces the page that has not been used for the longest period of time.,y
How is LRU page replacement related to the optimal algorithm?,It is like the optimal algorithm looking backward in time.,y
Does LRU page replacement suffer from Belady's anomaly?,"No, because it is a stack algorithm.",y
What is a 'stack algorithm'?,A class of page-replacement algorithms that do not suffer from Belady's anomaly.,y
What is required for the true implementation of the LRU algorithm?,Substantial hardware assistance.,y
How can LRU be implemented using counters?,Associate a time-of-use field with each page-table entry; the CPU logical clock increments; copy the clock to the field on reference. Replace the page with the smallest time value.,y
How can LRU be implemented using a stack?,"Keep a stack of page numbers; on reference, remove the page and put it on top. The most recently used page is at the top, and the least recently used is at the bottom. Best with a doubly linked list.",y
Why is true LRU implementation expensive?,Due to the need for per-memory-reference updates.,y
Why do many systems use LRU-approximation algorithms?,Because they lack the hardware for true LRU implementation.,y
What is a 'reference bit'?,An MMU bit indicating a page has been referenced.,y
How is the reference bit used in LRU approximation?,Hardware sets the bit when a page is referenced; the OS periodically clears the bits to determine which pages have been used (but not their exact order).,y
Describe the 'Additional-reference-bits algorithm'.,"It keeps an 8-bit byte for each page. On a timer interrupt (e.g., every 100ms), the OS shifts the reference bit into the high-order bit of the byte and shifts others right. The 8-bit shift registers show the history, and the page with the lowest number is considered LRU.",y
What is another name for the 'Second-chance page-replacement algorithm'?,The clock algorithm.,y
Describe the 'second-chance page-replacement algorithm'.,"It's a basic FIFO algorithm. If a selected page's reference bit is 0, it's replaced. If the reference bit is 1, it's given a second chance: the bit is cleared, its arrival time is reset, and it's not replaced until others are replaced or given second chances.",y
How is the second-chance algorithm typically implemented?,"As a circular queue with a pointer that advances, clearing reference bits, until a page with a 0-bit is found.",y
When does the second-chance algorithm degenerate to FIFO?,If all reference bits are set.,y
What is the 'clock' in the context of the second-chance algorithm?,A circular queue in the second-chance algorithm containing possible victim frames.,y
What two bits does the 'Enhanced second-chance algorithm' consider?,"The reference bit and the modify bit, as an ordered pair (reference bit, modify bit).",y
"List the four classes of pages in the Enhanced second-chance algorithm, from best to worst for replacement.","1. (0, 0): neither recently used nor modified (best to replace). 2. (0, 1): not recently used but modified (needs write-out). 3. (1, 0): recently used but clean (likely used again soon). 4. (1, 1): recently used and modified (likely used again soon, needs write-out).",y
What is the replacement preference in the Enhanced second-chance algorithm?,"It replaces the first page found in the lowest nonempty class, preferring clean pages to reduce I/Os.",y
How do counting-based page replacement algorithms generally work?,They keep a counter of references for each page.,y
Describe the 'Least Frequently Used (LFU)' page replacement algorithm.,It selects the page with the smallest access count for replacement.,y
What is a problem with the LFU algorithm?,A page that was heavily used initially but is now unused might retain a high count and not be replaced readily.,y
How can the problem of high counts in LFU be mitigated?,By shifting counts right periodically (creating an exponentially decaying average).,y
Describe the 'Most Frequently Used (MFU)' page replacement algorithm.,"It selects the page with the smallest access count for replacement, assuming that pages with the smallest count were just brought in and are therefore likely to be used in the future.",y
Are LFU and MFU common in practice?,Neither LFU nor MFU are common because they are expensive to implement and do not approximate the optimal algorithm well.,y
What is the purpose of 'Page-buffering algorithms'?,They are used in addition to page replacement algorithms to improve performance.,y
How does a 'pool of free frames' page-buffering algorithm work?,"On a page fault, the desired page is read into a free frame from the pool before the victim is written out, allowing the process to restart faster. The victim frame is added to the pool after its write-out.",y
How does a 'list of modified pages' page-buffering algorithm work?,"When the paging device is idle, modified pages are written to secondary storage and their modify bits are reset, increasing the probability of a clean page for replacement (no write-out needed during fault).",y
What is the benefit of a 'pool of free frames remembering old page' algorithm?,"If an old page is needed before its frame is reused, it can be reused directly from the pool without I/O. The free-frame pool is checked first on a page fault.",y
Which operating system uses page buffering with the second-chance algorithm?,UNIX.,y
Why might some applications perform worse with OS virtual memory buffering?,"Applications often understand their memory/storage use better than general-purpose OS algorithms, and double buffering can occur if both the OS and application buffer I/O.",y
Provide an example of an application scenario where general-purpose OS algorithms might be inefficient.,"Data warehouses performing sequential reads then computations/writes. LRU might remove older pages that will be read again, making MFU potentially more efficient.",y
What is 'raw disk'?,"Direct access to secondary storage as a large sequential array of logical blocks, bypassing file-system services.",y
What file-system services does 'raw I/O' bypass?,"Demand paging, locking, prefetching, allocation, names, and directories.",y
When are raw partitions generally efficient?,"They are efficient for specific applications that can manage their own storage, but most applications are better served by regular file-system services.",y
What is the primary issue addressed by frame allocation?,How to allocate a fixed amount of free memory among multiple processes.,y
"In a pure demand paging system, where are frames placed initially after OS memory allocation?",On the free-frame list.,y
What happens when a page fault occurs and frames are available?,The process gets free frames from the free-frame list.,y
What happens when the free-frame list is exhausted during a page fault?,A page-replacement algorithm is used to free up a frame.,y
What happens to a process's frames when it terminates?,They are returned to the free-frame list.,y
Describe a variation in frame allocation related to OS buffer/table space.,"The OS can allocate buffer/table space from the free-frame list, which can then be used for user paging when not actively in use by the OS.",y
Describe a variation in frame allocation involving reserved free frames.,"A small number of free frames (e.g., 3) can be reserved: one for a page fault, and others for selecting a replacement page during a swap operation.",y
What is the basic strategy for user process frame allocation?,A user process is allocated any available free frame.,y
What are the two main constraints on frame allocation?,1. Cannot exceed the total available frames (unless page sharing is involved). 2. Must allocate at least a minimum number of frames.,y
How does having fewer frames impact system performance?,It leads to a higher page-fault rate and slower execution.,y
What is the consequence if a page fault occurs before an instruction can complete?,The instruction must be restarted.,y
What is required regarding the number of frames for an instruction to complete correctly?,There must be enough frames for all pages an instruction can reference.,y
What is the minimum number of frames required for a single memory-reference instruction?,Two frames: one for the instruction itself and one for the memory reference.,y
What is the minimum number of frames required per process for one-level indirect addressing?,At least three frames.,y
What determines the minimum number of frames required for a process?,The computer architecture.,y
"For a 'move' instruction straddling two frames with two indirect operands, how many frames might be required?",Six frames.,y
How do Intel architectures typically limit the minimum number of frames needed?,"They only allow register-to-register or memory operations, which can limit the minimum frames required for an instruction.",y
What defines the maximum number of frames a process can be allocated?,The total available physical memory.,y
What is 'equal allocation' in the context of virtual memory frame management?,Assigns equal amounts of a resource (page frames) to all requestors (processes).,y
What is 'proportional allocation' in the context of virtual memory frame management?,"Assigns a resource (page frames) in proportion to some aspect of the requestor; in virtual memory, typically in proportion to process size.",y
What is the formula for calculating frames allocated to process 'pi' using proportional allocation?,"a_i ≈ (s_i/S) × m, where s_i is the virtual memory size of p_i, S is the total virtual memory size of all processes, and m is the total available frames.",y
What constraints apply to the calculated number of frames (a_i) in proportional allocation?,"a_i must be an integer, greater than the minimum frames required, and the sum of all a_i values must be less than or equal to the total available frames (m).",y
How does an increased multiprogramming level affect frame allocation per process?,"Processes lose frames (i.e., fewer frames are allocated per process).",y
How does a decreased multiprogramming level affect frame allocation per process?,"Frames are spread among fewer processes (i.e., more frames are allocated per process).",y
What is a limitation of equal and proportional allocation regarding process priority?,High-priority processes are treated the same as low-priority processes.,y
How can process priority be factored into frame allocation?,"By using proportional allocation based on process priority, or a combination of size and priority.",y
What is 'global replacement'?,"A page-replacement strategy where a process selects a replacement frame from all frames in the system, even if they are allocated to another process.",y
What is 'local replacement'?,A page-replacement strategy where a process selects a replacement frame only from its own allocated frames.,y
How does local replacement affect a process's frame allocation?,The number of frames allocated to a process does not change.,y
How does global replacement affect a process's frame allocation?,A process can increase its number of allocated frames by taking them from other processes.,y
What is a major problem associated with global replacement?,A process's performance depends on the paging behavior of other processes (external circumstances).,y
What is a key characteristic of local replacement regarding process performance?,A process's performance depends only on its own paging behavior.,y
Which page-replacement strategy generally leads to greater system throughput and is more common?,Global replacement.,y
What is a page fault?,An event where a page is referenced but has no valid mapping in memory.,y
What are the two types of page faults?,Major page faults (also known as hard faults) and minor page faults (also known as soft faults).,y
What is a 'major fault'?,A page fault that is resolved by performing I/O to bring the required page from secondary storage (backing store) into memory.,y
What actions are required to resolve a major page fault?,Reading from the backing store and updating the page table.,y
When do demand paging systems typically experience a high number of major faults?,"Initially, when many pages are first accessed and need to be loaded from disk.",y
What is a 'minor fault'?,A page fault that is resolved without paging in data from secondary storage.,y
Provide a reason for a minor page fault involving shared libraries.,"A shared library page may already be in memory, but the process has no logical mapping to it, requiring only an update to the process's page table.",y
Provide a reason for a minor page fault involving a reclaimed page.,"A page that was previously reclaimed to the free-frame list but not yet zeroed or reallocated can be reassigned to a process, requiring only its removal from the free-frame list.",y
How does the time consumption of minor faults compare to major faults?,Minor faults are less time-consuming than major faults.,y
What Linux command can be used to observe major and minor page faults?,"ps -eo min_flt,maj_flt,cmd",y
"What is a common observation regarding major and minor faults in Linux processes, and why?","Major faults are typically low, while minor faults are high, because Linux processes heavily use shared libraries.",y
"In a global page-replacement strategy, when are page replacements triggered?","When the free-frame list falls below a certain threshold, not necessarily at zero.",y
What is the purpose of triggering page replacements before the free-frame list is exhausted?,To ensure there is always sufficient free memory available.,y
What are 'reapers' in the context of memory management?,Routines that scan memory and free frames to maintain a minimum level of free memory.,y
When are kernel 'reaper' routines triggered?,When the amount of free memory falls below a minimum threshold.,y
From which processes do reapers reclaim pages?,"From all processes, excluding kernel processes.",y
How do reapers select pages for reclamation?,"They use page-replacement algorithms, typically LRU approximation.",y
When are reapers suspended and resumed?,They are suspended when free memory reaches a maximum threshold and resumed when it falls back below the minimum threshold.,y
What happens if reapers are unable to maintain free frames using their typical algorithm?,"They reclaim pages more aggressively, potentially using simpler algorithms like pure FIFO.",y
What is the 'out-of-memory (OOM) killer'?,A Linux routine that terminates processes to free memory when the amount of free memory becomes very low.,y
How is the OOM score used by the OOM killer?,A higher OOM score indicates a higher likelihood of the process being terminated.,y
How is a process's OOM score calculated?,By its memory usage percentage.,y
What is the path to view a process's OOM score in Linux?,/proc/<pid>/oom_score,y
Who can configure the minimum and maximum thresholds for reaper routines?,The system administrator.,y
What is the typical assumption about memory access in virtual memory systems?,Uniform memory access (UMA).,y
What is 'non-uniform memory access (NUMA)'?,"An architecture, common in systems with multiple CPUs, where memory access time varies based on the CPU core accessing it.",y
How does CPU access time differ in NUMA systems?,"A CPU accesses memory located locally (e.g., on the same system board) faster than memory located remotely.",y
What is the trade-off with NUMA systems compared to uniform access systems?,"NUMA systems are slower than uniform access for some operations, but they allow for more CPUs, leading to greater throughput and parallelism.",y
Why is managing page frame location critical for NUMA performance?,"To ensure that frames are allocated as close as possible to the CPU that will access them, minimizing latency.",y
How does a NUMA-aware system handle frame allocation during a page fault?,It attempts to allocate a frame that is physically close to the CPU experiencing the fault.,y
How can the scheduler improve performance in NUMA systems?,"By tracking the last CPU a process ran on and scheduling it on the same CPU, then allocating frames close to that CPU, leading to improved cache hits and decreased memory access times.",y
What issue do threads introduce for NUMA memory allocation?,"If a process has threads running on different system boards, allocating memory optimally for all threads becomes a challenge.",y
How does Linux address NUMA challenges related to scheduling domains?,"The kernel identifies scheduling domains, and the CFS scheduler tries to prevent thread migration across these domains to avoid memory access penalties.",y
How does Linux address NUMA challenges related to memory allocation?,"It maintains a separate free-frame list for each NUMA node, ensuring that a thread is allocated memory from the node it is running on.",y
What are 'lgroups' in Solaris?,"Locality groups in the kernel that gather CPUs and memory, allowing for optimized memory access within a defined latency.",y
Describe the structure and access within a Solaris lgroup.,"Each lgroup consists of a set of CPUs and memory, where any CPU in the group can access any memory in that group within a defined latency. Lgroups can also form a hierarchy.",y
How does Solaris utilize lgroups for scheduling and memory allocation?,"Solaris schedules threads and allocates memory within an lgroup; if not possible, it uses nearby lgroups to minimize memory latency and maximize CPU cache hit rates.",y
"What is ""thrashing"" in an operating system context?","A state where a process does not have enough physical memory frames (minimum needed for its working set), leading to quickly recurring page faults. It is characterized by high paging activity, where the system spends more time paging than executing.",y
What is a primary performance consequence of thrashing?,"Severe performance problems, including a plunge in system throughput and a tremendous increase in page-fault rate, leading to increased effective memory-access time.",y
Describe the common scenario that can trigger thrashing.,"The OS monitors low CPU utilization and, in an attempt to improve it, increases the degree of multiprogramming by initiating new processes.",y
Which type of page-replacement algorithm can contribute to thrashing in a multiprogramming environment?,"A global page-replacement algorithm, which replaces pages without regard to the process that owns them.",y
