Front,Back,Reversible
"How does a global page-replacement algorithm, combined with low CPU utilization, lead to thrashing?","A process needing more frames starts faulting and takes frames from other processes. This causes other processes to fault, taking frames from others. Faulting processes use the paging device, emptying the ready queue, which decreases CPU utilization. The CPU scheduler then increases multiprogramming further, taking more frames and leading to more page faults and longer paging device queues, causing CPU utilization to drop even more, thus perpetuating the cycle.",y
"How does CPU utilization generally change as the degree of multiprogramming increases, before thrashing occurs?",CPU utilization increases (though at a slower rate) until it reaches a maximum.,y
What happens to CPU utilization when the degree of multiprogramming is increased beyond the point where thrashing begins?,CPU utilization drops sharply.,y
What is the most direct way to stop thrashing once it has begun?,Decrease the degree of multiprogramming.,y
What types of page-replacement algorithms can limit the effects of thrashing?,Local replacement algorithms or priority replacement algorithms.,y
"Define a ""local replacement algorithm"".",A page replacement algorithm that avoids thrashing by not allowing a process to steal frames from other processes; a process selects pages only from its own allocated frames.,y
"Define a ""priority replacement algorithm"".",A page replacement algorithm that avoids thrashing by not allowing a process to steal frames from other processes.,y
What is a limitation of using local or priority replacement algorithms to limit thrashing?,"While a thrashing process cannot steal frames from others, it still queues for the paging device, increasing the average service time for page faults and, consequently, the effective access time for all processes.",y
What is the fundamental way to prevent thrashing?,Provide each process with enough physical memory frames.,y
"Define the ""locality model"".","A model for page replacement based on the working-set strategy, which states that during execution, a process moves from one 'locality' of memory references to another.",y
"In the context of the locality model, what is a ""locality""?",A set of pages that are actively used together by a program.,y
Describe the characteristics of localities in a running program.,"A running program typically consists of several overlapping localities, which are defined by its program structure and data structures.",y
"What fundamental principle, relevant to memory access patterns, is behind caching?","Accesses are patterned, not random (i.e., exhibiting locality).",y
"What is the ""working-set model"" based on?",The locality assumption.,y
What key parameter is used in the working-set model?,"Δ (delta), which defines the working-set window.",y
"Define ""working-set window"".",A limited set of most recently accessed pages (a 'window' view of the entire set of accessed pages). It specifically refers to the most recent Δ page references.,y
"Define ""working set"".","The set of pages that are contained within the working-set window (i.e., the pages in the most recent Δ references).",y
How long does a page remain in a working set?,"If a page is in active use, it remains in the working set. If it's no longer used, it drops from the working set Δ time units after its last reference.",y
What does a working set approximate?,A program's locality.,y
What determines the accuracy of the working set in approximating a program's locality?,The selection of the Δ (working-set window) parameter.,y
What is the consequence if the Δ parameter in the working-set model is too small?,The working set will not encompass the entire locality.,y
What is the consequence if the Δ parameter in the working-set model is too large?,The working set may overlap several localities.,y
What does the working set represent if Δ is infinite?,The working set would be all pages touched by the process during its entire execution.,y
What is the most important property derived from the working-set model?,The working-set size (WSSi) for each process.,y
"In the working-set model, how is the total demand for frames (D) calculated?","D = sum of WSSi, where WSSi is the working-set size for each process i.",y
"According to the working-set model, when does thrashing occur?","If the total demand for frames (D) exceeds the total available frames (m), meaning some processes lack sufficient frames for their working sets.",y
How does an OS use the working-set model to manage processes and memory?,"It monitors the working set of each process, allocates enough frames for its working-set size, initiates new processes if there are enough extra frames, and suspends processes (swapping their pages out) if the sum of working-set sizes exceeds available frames.",y
What are the main benefits of using the working-set model for memory management?,"It prevents thrashing, helps keep the degree of multiprogramming high, and optimizes CPU utilization.",y
What is the main difficulty in implementing the working-set model?,Accurately tracking the moving working-set window.,y
What is a common approximation method used to implement the working-set model?,Using a fixed-interval timer interrupt in conjunction with reference bits.,y
How does the fixed-interval timer interrupt and reference bit approximation work for working sets?,"At each timer interrupt, the OS copies and clears the reference bits. On a page fault, it examines the current reference bit and a few in-memory history bits. If at least one bit is on within the Δ window (e.g., last 10,000-15,000 references), the page is considered part of the working set.",y
What is a key limitation of the working-set approximation using timer interrupts and reference bits?,It cannot tell the exact reference time within an interval.,y
How can the accuracy of the working-set approximation be improved?,By increasing the number of history bits or increasing the interrupt frequency (though this comes at a higher cost).,y
"Define ""Page-Fault Frequency"" (PFF).",The frequency at which page faults occur.,y
What is the primary goal of the Page-Fault Frequency (PFF) strategy?,To prevent thrashing by directly controlling the page-fault rate.,y
How does the PFF strategy compare to the working-set model regarding thrashing control?,The working-set model is successful and useful for prepaging but can be clumsy for thrashing control; the PFF strategy is more direct.,y
How does the PFF strategy decide whether a process needs more or fewer frames?,"If the page-fault rate is too high, the process needs more frames. If it's too low, the process may have too many frames.",y
How does the PFF strategy operationalize its control over page-fault rates?,"It establishes upper and lower bounds for the desired page-fault rate. If the actual PFF exceeds the upper limit, another frame is allocated. If it falls below the lower limit, a frame is removed.",y
What action does the PFF strategy take if a process's page-fault rate increases but no free frames are available?,"The OS selects a process to swap out to backing store, and the freed frames are then distributed to the processes with high page-fault frequencies.",y
What is the current best practice for memory management to avoid thrashing and swapping?,Include enough physical memory in the system to avoid the occurrence of thrashing and excessive swapping.,y
What is the primary benefit of the current best practice in memory management (having enough physical memory)?,"It provides the best user experience across various devices, from smartphones to large servers.",y
What is memory compression an alternative to?,Paging.,y
How does memory compression reduce memory usage?,"By compressing several frames into a single frame, without swapping pages to disk.",y
Describe the initial trigger for memory compression based on the example process.,"A free-frame list falling below a set threshold, which triggers page replacement.",y
"What happens to selected frames (e.g., 15, 3, 35, 26) when page replacement is triggered for memory compression?",They are placed on a modified-frame list.,y
"In the memory compression process, what is done with the selected frames instead of writing them to swap space?","They are compressed (e.g., three frames) into a single page frame.",y
"What is the first step involving a free frame (e.g., Frame 7) in the memory compression process described in the example?",Frame 7 is removed from the free-frame list.,y
"After a free frame (e.g., Frame 7) is removed, what happens to the selected frames (e.g., 15, 3, 35) in the memory compression process?","They are compressed and stored in the allocated free frame (e.g., Frame 7).",y
"Where is the frame containing compressed data (e.g., Frame 7) stored after compression?",In a list of compressed frames.,y
"What happens to the original frames (e.g., 15, 3, 35) after their contents have been compressed and stored elsewhere?",They are moved back to the free-frame list.,y
What occurs if a compressed frame is referenced?,"A page fault is triggered, the frame is decompressed, and the original pages are restored.",y
Do mobile systems like Android and iOS typically support standard swapping/paging?,"No, they generally do not.",y
"What role does memory compression play in the memory-management strategy of mobile systems (Android, iOS)?",It is an integral part of their memory-management strategy.,y
Which major operating systems support memory compression?,Windows 10 and macOS.,y
"In Windows 10, which applications are candidates for memory compression?",Universal Windows Platform (UWP) apps on mobile devices.,y
How does macOS (Version 10.9+) utilize memory compression?,"It compresses LRU (Least Recently Used) pages when free memory is short, and then pages if needed.",y
How does memory compression performance compare to paging to an SSD on macOS?,Memory compression is faster than paging to an SSD on macOS.,y
What is a requirement for memory compression in terms of frame allocation?,It requires allocating free frames for compressed pages.,y
What is an example of significant memory saving possible with memory compression?,Compressing 3 frames into 1 frame.,y
What two factors are in contention regarding memory compression algorithms?,Compression speed and compression ratio (amount of reduction).,y
What is the trade-off associated with achieving higher compression ratios?,"It typically requires slower, more computationally expensive algorithms.",y
What is the balancing goal for most memory compression algorithms?,To achieve high ratios with fast algorithms.,y
How can memory compression performance be improved?,By using parallel compression with multiple cores.,y
Name two examples of fast memory compression algorithms and their typical compression effectiveness.,"Microsoft's Xpress and Apple's WKdm, which typically compress data to 30-50% of its original size.",y
Define memory compression.,An alternative to paging; compresses frame contents to decrease memory usage.,y
Define Universal Windows Platform (UWP).,A Windows 10 architecture providing a common app platform for all devices running Windows 10.,y
Define compression ratio.,"A measurement of compression effectiveness, specifically the ratio of compressed space to uncompressed space.",y
How are pages allocated for user-mode processes?,Pages are allocated from the kernel's free page frame list.,y
How is the kernel's free page frame list populated?,"By page-replacement algorithms (e.g., Section 10.4).",y
Describe the physical memory distribution of free pages for user-mode processes.,Free pages are scattered throughout physical memory.,y
What causes internal fragmentation when a user-mode process requests memory?,"A single byte request results in an entire page frame being granted, leading to internal fragmentation.",y
Why is kernel memory often allocated from a different free-memory pool than user-mode memory?,"1. Kernel requests vary in data structure sizes, some less than a page, requiring conservative memory use to minimize fragmentation.
2. Many OS do not subject kernel code/data to paging.
3. Hardware devices interact directly with physical memory (no virtual memory interface) and may require physically contiguous pages.",y
What are the main strategies for managing kernel free memory?,"""Buddy system"" and ""slab allocation"".",y
From where does the buddy system allocate memory?,From a fixed-size segment of physically contiguous pages.,y
"What is a ""power-of-2 allocator""?",An allocator in the buddy system that satisfies memory requests in units sized as a power of 2.,y
How does the buddy system handle a memory request that is not appropriately sized (power of 2)?,It is rounded up to the next highest power of 2.,y
"If a buddy system receives an 11 KB request, what size segment is granted?",A 16-KB segment (rounded up from 11 KB).,y
Describe the steps for a 21 KB kernel request from an initial 256 KB segment using the buddy system.,"1. Initial 256 KB segment divided into two 128 KB ""buddies"" ($A_L$ and $A_R$).
2. One buddy ($A_L$) divided into two 64 KB buddies ($B_L$ and $B_R$).
3. Next-highest power of 2 for 21 KB is 32 KB.
4. One 64 KB buddy ($B_L$) divided into two 32 KB buddies ($C_L$ and $C_R$).
5. One 32 KB buddy ($C_L$) is used for the 21 KB request.",y
"What are ""buddies"" in the context of memory allocation?",Pairs of equal size in buddy memory allocation.,y
What is a key advantage of the buddy system?,It can quickly combine adjacent buddies to form larger segments using coalescing.,y
"What is ""coalescing"" in the buddy system?",Combining freed memory in adjacent buddies into larger segments.,y
Give an example of coalescing in the buddy system after a 21 KB request is released.,"When the $C_L$ unit (32 KB) is released, it can coalesce with $C_R$ to form a 64 KB segment ($B_L$). This $B_L$ can then coalesce with $B_R$ to form a 128 KB segment ($A_L$), and eventually the original 256 KB segment.",y
What is the main drawback of the buddy system?,Rounding up requests to the next highest power of 2 causes internal fragmentation.,y
Give an example of internal fragmentation in the buddy system.,"A 33 KB request leads to a 64 KB segment allocation, potentially wasting nearly 50% of the allocated unit.",y
"What is ""slab allocation""?","A memory allocation method where a slab is split into object-sized chunks, eliminating fragmentation.",y
"What is a ""slab"" in slab allocation?",A section of memory consisting of one or more physically contiguous pages.,y
"What is a ""cache"" in the context of the slab allocator?","One or more slabs used to store temporary data copies for performance; in the slab allocator, it consists of one or more slabs.",y
How many caches does the slab allocator typically use for kernel data structures?,"A single cache is used for each unique kernel data structure (e.g., process descriptors, file objects, semaphores).",y
"What is an ""object"" in the context of slab allocation?",An instantiation of a kernel data structure.,y
How are caches populated in the slab allocator?,"Each cache is populated with ""objects"" (instantiations of the kernel data structure it manages).",y
Describe the process of allocating an object using the slab allocator.,"1. When a cache is created, objects are allocated to it, initially marked as `free`.
2. The number of objects depends on the slab size (e.g., a 12 KB slab could hold six 2 KB objects).
3. When a new object is needed, the allocator assigns any `free` object from the cache, marking it `used`.",y
"How does the slab allocator fulfill a kernel request for a process descriptor (e.g., `struct task_struct`, ~1.7 KB)?","The cache associated with `struct task_struct` fulfills the request with a pre-allocated, free `struct task_struct` object.",y
What are the three states a slab can be in within Linux?,"1. `Full`: All objects in the slab are `used`.
2. `Empty`: All objects in the slab are `free`.
3. `Partial`: The slab has both `used` and `free` objects.",y
In what order does the slab allocator try to satisfy a request for a free object?,"1. First, it looks for a free object in a partial slab.
2. If none, it looks for a free object from an empty slab.
3. If no empty slabs, a new slab is allocated from contiguous physical pages, assigned to the cache, and object memory is allocated from this new slab.",y
What is the first main benefit of the slab allocator?,"No memory is wasted due to fragmentation. Each kernel data structure has an associated cache, which is made of slabs divided into object-sized chunks, ensuring the exact amount of memory requested by the kernel is returned.",y
What is the second main benefit of the slab allocator?,"Memory requests are satisfied quickly, which is effective for frequent object allocation/deallocation common in the kernel. Objects are created in advance, quickly allocated from the cache, and released objects are marked free and immediately available.",y
"Where did the slab allocator first appear, and where is it used today?",It first appeared in the Solaris 2.4 kernel. It is now used for some user-mode requests in Solaris. Linux adopted it (Version 2.2+) and referred to it as SLAB.,y
What are the recent Linux kernel memory allocators mentioned?,SLOB and SLUB.,y
What is the purpose of the SLOB allocator?,"It is designed for systems with limited memory, such as embedded systems.",y
How does the SLOB allocator work?,"It maintains three lists (`small` <256 bytes, `medium` <1,024 bytes, `large` other objects < page size) and allocates from the appropriate list using a first-fit policy.",y
What is the status of the SLUB allocator in Linux?,It is the default allocator for the Linux kernel (Version 2.6.24+) and replaced SLAB.,y
How did the SLUB allocator reduce SLAB overhead related to metadata?,"It stores metadata in the `page` structure, not with each slab.",y
How did the SLUB allocator improve memory saving on multi-processor systems compared to SLAB?,"It removed per-CPU queues for objects, leading to significant memory savings.",y
How does the SLUB allocator perform with more processors?,It offers better performance with more processors.,y
What is the initial drawback of pure demand paging?,"A large number of page faults when a process starts, due to initial locality.",y
"Define ""prepaging.""","Bringing pages into memory before they are requested, in an attempt to prevent high initial paging.",y
What is the strategy behind prepaging?,To bring some or all needed pages into memory at once.,y
Provide an example of prepaging in practice.,"Using the working-set model to remember a suspended process's working set, then automatically bringing the entire working set back into memory before restarting the process.",y
What is the main advantage of prepaging?,The potential cost saving of prepaging compared to the cost of servicing multiple individual page faults.,y
What is the primary risk associated with prepaging?,"Many prepaged pages may not actually be used, leading to wasted effort and memory.",y
"In prepaging cost analysis, what do 's' and 'α' represent?",'s' represents the number of pages prepaged. 'α' represents the fraction of 's' pages actually used (where 0 ≤ α ≤ 1).,y
When does prepaging 'lose' or 'win' based on the fraction of used pages (α)?,"If α is approximately 0, prepaging loses (more wasted effort). If α is approximately 1, prepaging wins (more saved page faults).",y
Is prepaging executable programs generally easy or difficult? Why?,"It is difficult because it's unclear what pages (code, data, stack, heap) will be needed and should be brought in.",y
Is prepaging files more predictable than prepaging executable programs? Why?,"Yes, because files are often accessed sequentially, making it easier to predict future page needs.",y
What Linux system call is an example of file prepaging?,"The `readahead()` system call, which prefetches file contents into memory.",y
When is the decision on the best page size typically made?,During new machine design.,y
What are common properties of page sizes in computer systems?,"They are invariably powers of 2, typically ranging from 4,096 bytes (2¹²) to 4,194,304 bytes (2²²).",y
How does decreasing page size affect page table size?,"Decreasing page size increases the number of pages, which in turn increases the page table size.",y
"From the perspective of page table size, what page size is desirable?","A large page size is desirable because each active process has its own copy of the page table, and a larger page size means fewer entries are needed.",y
What is internal fragmentation in the context of memory utilization with paging?,"It is the unused portion of a page that is allocated to a process, occurring because a process's memory requirements rarely end exactly on a page boundary.",y
How does page size relate to memory utilization and internal fragmentation?,"Memory is better utilized with smaller pages, as this minimizes the average waste (half of the final page) due to internal fragmentation.",y
What are the three main components of time involved in reading or writing a page?,"Seek time, rotational latency, and transfer time.",y
"How does transfer time relate to page size, and what page size does this argue for?","Transfer time is proportional to page size, which argues for a small page size to minimize transfer time.",y
"Which components of I/O time typically dominate, and what does this imply for page size?","Latency and seek time typically dwarf transfer time. This implies that doubling the page size has only a minimal increase in total I/O time, thus arguing for a larger page size to reduce the number of I/O operations.",y
How do smaller page sizes affect locality and resolution?,"Smaller page sizes improve locality and total I/O efficiency because each page matches program locality more accurately, providing better ""resolution"" by isolating only the memory actually needed.",y
What is the trade-off between small and large page sizes regarding I/O and allocated memory from a locality perspective?,"Smaller page sizes result in less I/O and less total allocated memory by avoiding the allocation/transfer of unneeded data within a page, unlike larger page sizes.",y
"How does page size impact the number of page faults, and what page size minimizes page faults?","A smaller page size generally leads to more page faults. To minimize page faults, a larger page size is needed, as it reduces the frequency of needing to fetch new pages.",y
What are some overhead costs associated with each page fault?,"An interrupt, saving registers, replacing a page, queuing for disk I/O, and updating page tables.",y
What has been the historical trend regarding page sizes?,"A trend toward larger page sizes, even for mobile systems, with modern systems adopting much larger sizes (e.g., Linux huge pages).",y
"Define ""hit ratio"" in the context of a TLB.","Percentage of times a cache provides a valid lookup (e.g., TLB effectiveness).",y
What is a downside of increasing the number of TLB entries to increase the hit ratio?,It is expensive and power-hungry due to the use of associative memory.,y
"Define ""TLB reach.""",Amount of memory addressable by the translation look-aside buffer.,y
How is TLB reach calculated?,Number of TLB entries × Page size.,y
"Ideally, what should the TLB reach be able to contain?",The entire working set for a process.,y
What happens if a process has insufficient TLB reach?,"The process will spend a significant amount of time resolving memory references by traversing the main page table in memory, instead of using the fast TLB.",y
"Besides increasing the number of TLB entries, what are other approaches to increase TLB reach?",Increase the page size or provide support for multiple page sizes.,y
"How does increasing the page size affect TLB reach, given the same number of TLB entries?","It directly multiplies the TLB reach (e.g., changing from 4 KB to 16 KB pages quadruples TLB reach).",y
What is a potential downside of using larger page sizes to increase TLB reach?,Increased internal fragmentation for some applications.,y
What is a common feature regarding page size support in most modern architectures?,They support multiple page sizes.,y
What is the default and an example of a larger page size supported by Linux?,"Linux has a default page size of 4 KB and also supports ""huge pages"" (e.g., 2 MB).",y
"Define ""huge pages.""","A feature designating a region of physical memory for especially large pages, supported by modern systems like Linux.",y
"Define ""contiguous bit"" in the context of an ARM v8 TLB entry.","In ARM v8 CPUs, a TLB bit indicating mapping to contiguous memory blocks.",y
"What is the purpose of the ""contiguous bit"" in ARM v8 TLB entries?","To allow a single TLB entry to map a larger, contiguous block of memory, effectively increasing the TLB reach without increasing the number of TLB entries.",y
"When multiple page sizes are supported, which component may manage the TLB?","The Operating System (OS), rather than hardware alone.",y
What is the trade-off associated with software-managed TLB?,"It introduces performance cost, but this can be offset by the increased hit ratio and TLB reach it allows.",y
What is the primary purpose of inverted page tables?,To reduce the amount of physical memory needed for virtual-to-physical address translations.,y
How do inverted page tables achieve their purpose?,"They use one entry per page of physical memory, indexed by a combination of process ID and page number (<process-id, page-number>).",y
What is a key benefit of inverted page tables?,"They significantly reduce the physical memory required to store translation information, as there is only one entry per physical frame, not per virtual page for every process.",y
