Front,Back,Reversible
What is a major downside of inverted page tables concerning process address space information?,"They no longer contain complete information about the logical address space of a process, which is needed for handling page faults.",y
How do systems using inverted page tables handle the need for logical address space information during page faults?,"They keep an ""external page table"" (one per process) that looks like a traditional page table and contains virtual page location information.",y
"When are these external page tables typically referenced, and why is this acceptable?","They are referenced only on a page fault, and thus do not need to be quickly available. They can even be paged in/out themselves as necessary.",y
What special case can occur with inverted page tables during a page fault?,A page fault may cause another page fault if the external page table itself needs to be paged in.,y
What does the special case of external page table paging require and cause?,It requires careful kernel handling and can cause a delay in page-lookup processing.,y
How is demand paging typically designed concerning user programs?,It is designed to be transparent to the user program.,y
"Can system performance with demand paging be improved even if it's transparent? If so, how?","Yes, system performance can be improved if the user or compiler is aware of demand paging and optimizes program structure accordingly.",y
Illustrate how program structure affects page faults using the 128x128 array initialization example.,"Initializing in row-major order (accessing one word in each page repeatedly) leads to 16,384 page faults if fewer than 128 frames are allocated. Initializing in column-major order (accessing all words on one page before moving to the next) reduces page faults to 128.",y
What is the general principle for selecting data and programming structures to improve paging performance?,"Careful selection can increase locality, lower the page-fault rate, and result in a smaller working set.",y
Provide an example of a data structure with good locality.,"A stack, because access is always to the top.",y
Provide an example of a data structure with bad locality.,"A hash table, because it tends to scatter memory references.",y
"What does ""locality of reference"" measure regarding data structure efficiency?",It is one measure of how efficiently a data structure will perform in a paged memory system.,y
"Besides locality of reference, what other factors contribute to data structure efficiency?","Search speed, total memory references, and total pages touched.",y
How can compilers and loaders positively affect paging performance regarding code and data?,"By separating code and data and creating reentrant code, code pages can be read-only and never modified, thus becoming ""clean pages"" that don't need to be paged out.",y
How can loaders optimize routine placement for better paging performance?,By avoiding placing routines across page boundaries (keeping a routine within a single page) and by packing frequently calling routines into the same page.,y
What classic computer science problem is analogous to packing variable-sized load segments into fixed-sized pages to minimize interpage references?,A variant of the bin-packing problem.,y
"Why do pages sometimes need to be ""locked"" in memory in a demand paging system?",To prevent pages involved in ongoing I/O operations (to/from user virtual memory) from being paged out by the replacement algorithm.,y
Describe the problem that can occur if I/O buffers are not locked.,"If a process initiates I/O to a memory buffer and then is suspended, other processes can cause page faults that replace the I/O buffer's page. When the I/O operation completes, it writes to a physical frame now holding a different page, corrupting data.",y
What is one solution to the I/O paging problem that involves copying data?,"Never execute I/O directly to user memory. Instead, copy data between system memory (where I/O occurs) and user memory.",y
What is the main drawback of copying data between system and user memory for I/O?,It can introduce high overhead due to extra copying operations.,y
"What is the preferred solution to the I/O paging problem, involving page state?","Allow pages to be ""locked"" into memory using a lock bit associated with every frame. A locked frame cannot be selected for replacement.",y
Briefly describe the process for using a lock bit during a write to disk.,"The pages containing the block to be written are locked into memory. Once the I/O operation is complete, the pages are unlocked.",y
"Define ""locked"" in the context of memory pages.",Fixed in place; pages locked in memory to prevent paging out.,y
"Define ""pinning"" in the context of memory pages.",Locking pages into memory to prevent them from being paged out.,y
Why do operating system kernels often keep some or all of their pages locked in memory?,"Many OS designs cannot tolerate a kernel page fault, as it would likely crash the system.",y
"Can user processes also lock pages, and what is this called?","Yes, user processes may need to lock pages, which is commonly referred to as ""pinning.""",y
Provide an example of a user process that might need to pin pages.,A database process that manages large chunks of memory and frequently moves blocks between secondary storage and memory.,y
What are the typical requirements and risks associated with applications using pinning?,"Applications often require special privileges for pinning, and if abused, it can stress memory-management algorithms and deplete available free frames.",y
How can a lock bit be used in a scenario involving a low-priority and a high-priority process during page replacement?,"When a low-priority process faults and a page is read into memory, if a high-priority process then faults and needs a replacement, the newly brought-in page (clean, not referenced/modified) looks like a perfect candidate. A lock bit can prevent its replacement until the faulting process has been dispatched again and used it once.",y
What is a significant danger if a lock bit mechanism has a bug?,"A lock bit may get turned on but never turned off, rendering the associated physical frame permanently unusable.",y
"How does Solaris handle page locking requests from applications, specifically concerning ""locking hints""?","Solaris allows applications to provide ""locking hints,"" but the OS can disregard them if the free-frame pool becomes too small or if a process requests an excessive number of locked pages.",y
